"","Item_ID","Sentence","ModalPresent","HaveNeedTo","Finite","QuestionType","DegreeQ","SubjectAuxInv","WhAll","QuantifiedSubject","QuantifiedPredicate","Wh","MatVerb","MatVerbPart","Modal","Verb1","Verb2","Verb3","DeterminerSubject","DeterminerNonSubject","FullWhPhrase","WhNode","WhParse","Question","SentenceParse","WhPhaseType"
"133","77930:15","well most of what they're talking about *t*-2 in washington is, is the crime problems that they're having *t*-1 there.","no","no","yes","relative","no","","","","","what","","","","is","","","","the","",NA,"(WP what)","what they're talking about *t*-2 in washington","(TOP (S (INTJ (UH Well)) (NP-SBJ (NP (JJS most)) (PP (IN of) (SBAR-NOM (WHNP-2 (WP what)) (S (NP-SBJ (PRP they)) (VP (VBP 're) (VP (VBG talking) (PP (IN about) (NP (-NONE- *T*-2))) (PP-LOC (IN in) (NP (NNP Washington))))))))) (EDITED (RM (-DFL- \[)) (VP-UNF (VBZ is)) (, ,) (IP (-DFL- \+))) (VP (VBZ is) (RS (-DFL- \])) (NP-PRD (NP (DT the) (NN crime) (NNS problems)) (SBAR (WHNP-1 (IN that)) (S (NP-SBJ (PRP they)) (VP (VBP 're) (VP (VBG having) (NP (-NONE- *T*-1)) (ADVP-LOC (RB there)))))))) (. .) (-DFL- E_S)))","monomorphemic"
"134","45572:10","well, when i came home *t*-1, i opened the door","no","no","yes","subject","no","","","","","when","","","","opened","","","","the","",NA,"(WRB when)","when i came home *t*-1","(TOP (S (INTJ (UH Well)) (, ,) (SBAR-TMP (WHADVP-1 (WRB when)) (S (NP-SBJ (PRP I)) (VP (VBD came) (ADVP-DIR (NN home)) (ADVP-TMP (-NONE- *T*-1))))) (, ,) (NP-SBJ (PRP I)) (VP (VBD opened) (NP (DT the) (NN door))) (-DFL- E_S)))","monomorphemic"
"135","136185:5","when i'm home *t*-1, sometimes in the day i'll i'll watch them","no","no","yes","subject","no","","","","","","","","","watch","watch","","","","",NA,"(WRB When)","when i'm home *t*-1","(TOP (S (SBAR-TMP (WHADVP-1 (WRB When)) (S (NP-SBJ (PRP I)) (VP (VBP 'm) (ADVP-LOC-PRD (RB home)) (ADVP-TMP (-NONE- *T*-1))))) (, ,) (ADVP-TMP (RB sometimes)) (PP-TMP (IN in) (NP (DT the) (NN day))) (EDITED (RM (-DFL- \[)) (S (NP-SBJ (PRP I)) (VP-UNF (MD 'll))) (IP (-DFL- \+))) (NP-SBJ (PRP I)) (VP (MD 'll) (RS (-DFL- \])) (VP (VB watch) (NP (PRP them)))) (-DFL- E_S)))","monomorphemic"
"136","152254:9","um, what's your situation *t*-1?","no","no","yes","exclamation","no","yes","","","","what","","","","","","","","","",NA,"(WP what)","um, what's your situation *t*-1?","(TOP (SBARQ (INTJ (UH Um)) (, ,) (WHNP-1 (WP what)) (SQ (BES 's) (NP-SBJ (PRP$ your) (NN situation)) (NP-PRD (-NONE- *T*-1))) (. ?) (-DFL- E_S)))","monomorphemic"
"137","116983:11","that's what she plans *-1 to do *t*-2.","no","no","yes","subject","no","","","","","what","'s","","","plans","","","that","","",NA,"(WP what)","what she plans *-1 to do *t*-2","(TOP (S (NP-SBJ (DT That)) (VP (BES 's) (SBAR-NOM-PRD (WHNP-2 (WP what)) (S (NP-SBJ-1 (PRP she)) (VP (VBZ plans) (S (NP-SBJ (-NONE- *-1)) (VP (TO to) (VP (VB do) (NP (-NONE- *T*-2))))))))) (. .) (-DFL- E_S)))","monomorphemic"
"138","51842:48","or or, if that seems like a real accessible place to where you could, you know, go, in and get one *t*-1.","yes","no","yes","relative","no","","","","one","where","","","could","seems","","","that","a","",NA,"(WRB where)","where you could, you know, go, in and get one *t*-1","(TOP (FRAG (EDITED (RM (-DFL- \[)) (CC or) (IP (-DFL- \+))) (CC or) (, ,) (RS (-DFL- \])) (SBAR-ADV (IN if) (S (NP-SBJ (DT that)) (VP (VBZ seems) (PP (IN like) (NP (NP (DT a) (ADJP (RB real) (JJ accessible)) (NN place)) (PP (IN to) (SBAR (WHADVP-1 (WRB where)) (S (NP-SBJ (PRP you)) (VP (MD could) (PRN (, ,) (S (NP-SBJ (PRP you)) (VP (VBP know))) (, ,)) (VP (VP (VB go) (, ,) (ADVP-DIR (RB in))) (CC and) (VP (VB get) (NP (CD one))) (ADVP-LOC (-NONE- *T*-1)))))))))))) (. .) (-DFL- E_S)))","monomorphemic"
"139","4576:29","like i know a little bit about people who *t*-1 were considered *-2 very healthy in china","no","no","yes","relative","no","","","","","who","","","","know","","","","who","",NA,"(WDT who)","who *t*-1 were considered *-2 very healthy in china","(TOP (S (INTJ (UH like)) (NP-SBJ (PRP I)) (VP (VBP know) (NP (NP (DT a) (JJ little) (NN bit)) (PP (IN about) (NP (NP (NNS people)) (SBAR (WHNP-1 (WDT who)) (S (NP-SBJ-2 (-NONE- *T*-1)) (VP (VBD were) (VP (VBN considered) (S (NP-SBJ (-NONE- *-2)) (ADJP-PRD (RB very) (JJ healthy) (PP-LOC (IN in) (NP (NNP China))))))))))))) (-DFL- E_S)))","monomorphemic"
"140","100856:14","i started back when it *exp*-2 wasn't, stylish * to do that at all *t*-1.","no","no","yes","embedded","no","","","","all","when","started","","","started","","","","that","",NA,"(WRB when)","back when it *exp*-2 wasn't, stylish * to do that at all *t*-1","(TOP (S (NP-SBJ (PRP I)) (VP (VBD started) (SBAR-TMP (ADVP (RB back)) (WHADVP-1 (WRB when)) (S (NP-SBJ (NP (PRP it)) (S (-NONE- *EXP*-2))) (VP (VBD was) (RB n't) (, ,) (ADJP-PRD (JJ stylish)) (S-2 (NP-SBJ (-NONE- *)) (VP (TO to) (VP (VB do) (NP (DT that))))) (ADVP (IN at) (DT all)) (ADVP-TMP (-NONE- *T*-1)))))) (. .) (-DFL- E_S)))","monomorphemic"
"141","132186:11","that's where i think 0 most of the cost is coming *t*-1.","no","no","yes","embedded","no","","","most","most","where","'s","","","think","","","the","the","",NA,"(WRB where)","where i think 0 most of the cost is coming *t*-1","(TOP (S (NP-SBJ (DT That)) (VP (BES 's) (SBAR-PRD (WHADVP-1 (WRB where)) (S (NP-SBJ (PRP I)) (VP (VBP think) (SBAR (-NONE- 0) (S (NP-SBJ (NP (JJS most)) (PP (IN of) (NP (DT the) (NN cost)))) (VP (VBZ is) (VP (VBG coming) (ADVP (-NONE- *T*-1)))))))))) (. .) (-DFL- E_S)))","monomorphemic"
"142","40493:90","and, uh, when school lets out *t*-1, i just don't, i haven't, i have no idea what i'm going *-2 to do *t*-3, because i certainly can't afford what we did *t*-4 last year which *t*-5 was,","no","no","yes","relative","no","","","","","what","","","","have","","","","no","",NA,"(WP what)","what i'm going *-2 to do *t*-3","(TOP (S (CC and) (, ,) (INTJ (UH uh)) (, ,) (SBAR-TMP (WHADVP-1 (WRB when)) (S (NP-SBJ (NN school)) (VP (VBZ lets) (PRT (RP out)) (ADVP-TMP (-NONE- *T*-1))))) (, ,) (EDITED (RM (-DFL- \[)) (EDITED (RM (-DFL- \[)) (S (NP-SBJ (PRP I)) (ADVP (RB just)) (VP-UNF (VBP do) (RB n't))) (, ,) (IP (-DFL- \+))) (S (NP-SBJ (PRP I)) (VP-UNF (VBP have) (RB n't))) (, ,) (RS (-DFL- \])) (IP (-DFL- \+))) (NP-SBJ (PRP I)) (VP (VBP have) (RS (-DFL- \])) (NP (NP (DT no) (NN idea)) (SBAR (WHNP-3 (WP what)) (S (NP-SBJ-2 (PRP I)) (VP (VBP 'm) (VP (VBG going) (S (NP-SBJ (-NONE- *-2)) (VP (TO to) (VP (VB do) (NP (-NONE- *T*-3)))))))))) (, ,) (SBAR-PRP (IN because) (S (NP-SBJ (PRP I)) (ADVP (RB certainly)) (VP (MD ca) (RB n't) (VP (VB afford) (SBAR-NOM (WHNP-4 (WP what)) (S (NP-SBJ (PRP we)) (VP (VP (VBD did) (NP (-NONE- *T*-4)) (NP-TMP (JJ last) (NN year))) (SBAR (WHNP-5 (WDT which)) (S (NP-SBJ (-NONE- *T*-5)) (VP-UNF (VBD was)))))))))))) (, ,) (-DFL- N_S)))","monomorphemic"
"143","80573:19","well, we'll see how it goes *t*-1,","no","no","yes","embedded","no","","","","","how","see","","","see","see","","","","",NA,"(WRB how)","how it goes *t*-1","(TOP (S (INTJ (UH Well)) (, ,) (NP-SBJ (PRP we)) (VP (MD 'll) (VP (VB see) (SBAR (WHADVP-1 (WRB how)) (S (NP-SBJ (PRP it)) (VP (VBZ goes) (ADVP-MNR (-NONE- *T*-1))))))) (, ,) (-DFL- E_S)))","monomorphemic"
"144","52018:24","what *t*-1's, what *t*-2's your most recent one that you've seen *t*-3?","no","no","yes","root","no","yes","","","most","what","","","","","","","","that","",NA,"(WP what)","what *t*-1's, what *t*-2's your most recent one that you've seen *t*-3?","(TOP (SBARQ (EDITED (RM (-DFL- \[)) (SBARQ (WHNP-1 (WP What)) (SQ (NP-SBJ (-NONE- *T*-1)) (VP-UNF (BES 's)))) (, ,) (IP (-DFL- \+))) (WHNP-2 (WP what)) (SQ (NP-SBJ (-NONE- *T*-2)) (VP (BES 's) (RS (-DFL- \])) (NP-PRD (NP (PRP$ your) (ADJP (RBS most) (JJ recent)) (NN one)) (SBAR (WHNP-3 (WDT that)) (S (NP-SBJ (PRP you)) (VP (VBP 've) (VP (VBN seen) (NP (-NONE- *T*-3))))))))) (. ?) (-DFL- E_S)))","monomorphemic"
"145","1042:44","so, maybe that is a, a little bit of what privacy is *t*-1.","no","no","yes","relative","no","","","","","what","","","","is","","","that","a","",NA,"(WP what)","what privacy is *t*-1","(TOP (S (RB so) (, ,) (ADVP (RB maybe)) (NP-SBJ (DT that)) (VP (VBZ is) (EDITED (RM (-DFL- \[)) (NP-PRD-UNF (DT a)) (, ,) (IP (-DFL- \+))) (NP-PRD (NP (DT a) (RS (-DFL- \])) (JJ little) (NN bit)) (PP (IN of) (SBAR-NOM (WHNP-1 (WP what)) (S (NP-SBJ (NN privacy)) (VP (VBZ is) (NP-PRD (-NONE- *T*-1)))))))) (. .) (-DFL- E_S)))","monomorphemic"
"146","22176:7","and what we have *t*-2 here in burlington, which *t*-1 it doesn't cost a lot of money, but they have a kids council that they have all these after school activities for kids *t*-3.","no","no","yes","subject","no","","","","","what","","","","have","","","","a","",NA,"(WP what)","what we have *t*-2 here in burlington","(TOP (S (CC And) (SBAR-ADV (WHNP-2 (WP what)) (S (NP-SBJ (PRP we)) (VP (VBP have) (NP (-NONE- *T*-2)) (ADVP-LOC (RB here) (PP (IN in) (NP (NNP Burlington))))))) (PRN (, ,) (SBAR (WHNP-1 (WDT which)) (S (NP-SBJ (NP (-NONE- *T*-1)) (NP (PRP it))) (VP (VBZ does) (RB n't) (VP (VB cost) (NP (NP (DT a) (NN lot)) (PP (IN of) (NP (NN money)))))))) (, ,) (CC but)) (NP-SBJ (PRP they)) (VP (VBP have) (NP (NP (DT a) (NNS kids) (NN council)) (SBAR (WHADVP-3 (WDT that)) (S (NP-SBJ (PRP they)) (VP (VBP have) (NP (NP (PDT all) (DT these) (IN after) (NN school) (NNS activities)) (PP (IN for) (NP (NNS kids)))) (ADVP (-NONE- *T*-3))))))) (. .) (-DFL- E_S)))","monomorphemic"
"147","6844:29","i mean, they have a training center where they teach them *t*-1,","no","no","yes","relative","no","","","","","where","","","","have","","","","a","",NA,"(WRB where)","where they teach them *t*-1","(TOP (S (PRN (S (NP-SBJ (PRP I)) (VP (VBP mean))) (, ,)) (NP-SBJ (PRP they)) (VP (VBP have) (NP (NP (DT a) (NN training) (NN center)) (SBAR (WHADVP-1 (WRB where)) (S (NP-SBJ (PRP they)) (VP (VBP teach) (NP (PRP them)) (ADVP-LOC (-NONE- *T*-1))))))) (, ,) (-DFL- E_S)))","monomorphemic"
"148","101475:34","um, and you can make a lot at one time when i needed *-1 to make something 0 * to, uh, to give somebody *t*-2. you know, like, you know, to take *t*-2 over to somebody's house or something else *t*-3.","no","yes","yes","embedded","no","","","","something","when","make","","","make","make","","","a","",NA,"(WRB when)","when i needed *-1 to make something 0 * to, uh, to give somebody *t*-2. you know, like, you know, to take *t*-2 over to somebody's house or something else *t*-3","(TOP (S (INTJ (UH Um)) (, ,) (CC and) (NP-SBJ (PRP you)) (VP (MD can) (VP (VB make) (NP (DT a) (NN lot)) (PP-TMP (IN at) (NP (CD one) (NN time))) (SBAR-TMP (WHADVP-3 (WRB when)) (S (NP-SBJ-1 (PRP I)) (VP (VBD needed) (S (NP-SBJ (-NONE- *-1)) (VP (TO to) (VP (VB make) (NP (NP (NN something)) (SBAR (WHNP-2 (-NONE- 0)) (S (NP-SBJ (-NONE- *)) (EDITED (RM (-DFL- \[)) (VP-UNF (TO to)) (, ,) (IP (-DFL- \+))) (INTJ (UH uh)) (, ,) (VP (VP (TO to) (RS (-DFL- \])) (VP (VB give) (NP (NN somebody)) (NP (-NONE- *T*-2)))) (PRN (. .) (S (NP-SBJ (PRP You)) (VP (VBP know))) (, ,)) (INTJ (UH like)) (PRN (, ,) (S (NP-SBJ (PRP you)) (VP (VBP know))) (, ,)) (VP (TO to) (VP (VP (VB take) (NP (-NONE- *T*-2)) (PP-DIR (IN over) (PP (IN to) (NP (NP (NN somebody) (POS 's)) (NN house))))) (CC or) (NP-ETC (NP (NN something)) (ADVP (RB else)))))))))))) (ADVP-TMP (-NONE- *T*-3))))))) (. .) (-DFL- E_S)))","monomorphemic"
"149","107041:69","they need to a lot a more community awareness of just what is it *exp*-3 mean *t*-4 * to recycle, and what can you recycle *t*-1 and what you can't *?* *t*-2. because, you know, not a lot of people do really know what, you know, what it's for *t*-5.","yes","no","yes","relative","no","yes","","","","what","","","can","need","","","a","a","",NA,"(WP what)","what can you recycle *t*-1","(TOP (S (NP-SBJ (PRP they)) (VP (VBP need) (X (TO to) (DT a) (NN lot) (DT a)) (NP (NP (JJR more) (NN community) (NN awareness)) (PP (IN of) (SBARQ (SBARQ (WHNP-4 (RB just) (WP what)) (SQ (TYPO (VBZ is)) (NP-SBJ (NP (PRP it)) (S (-NONE- *EXP*-3))) (VP (VB mean) (NP (-NONE- *T*-4)) (S-3 (NP-SBJ (-NONE- *)) (VP (TO to) (VP (VB recycle))))))) (, ,) (CC and) (SBARQ (WHNP-1 (WP what)) (SQ (MD can) (NP-SBJ (PRP you)) (VP (VB recycle) (NP (-NONE- *T*-1))))) (CC and) (SBAR (WHNP-2 (WP what)) (S (NP-SBJ (PRP you)) (VP (MD ca) (RB n't) (VP (-NONE- *?*) (NP (-NONE- *T*-2))))))))) (. .) (SBAR-PRP (RB Because) (PRN (, ,) (S (NP-SBJ (PRP you)) (VP (VBP know))) (, ,)) (S (NP-SBJ (NP (RB not) (DT a) (NN lot)) (PP (IN of) (NP (NNS people)))) (VP (VBP do) (ADVP (RB really)) (VP (VB know) (SBAR (EDITED (RM (-DFL- \[)) (WHNP-UNF (WP what)) (, ,) (IP (-DFL- \+))) (PRN (S (NP-SBJ (PRP you)) (VP (VBP know))) (, ,)) (WHNP-5 (WP what)) (RS (-DFL- \])) (S (NP-SBJ (PRP it)) (VP (BES 's) (PP-PRD (IN for) (NP (-NONE- *T*-5))))))))))) (. .) (-DFL- E_S)))","monomorphemic"
"150","87696:93","if we had been like a chicago or a new york city or philadelphia or someone like that, and had a public transportation system starting in the horse and buggy days and when land was cheap and, uh, construction costs were cheap *t*-1, you could afford it.","no","no","yes","subject","no","","","","","when","had","","","starting","afford","been","a","a","",NA,"(WRB when)","when land was cheap and, uh, construction costs were cheap *t*-1","(TOP (S (SBAR-ADV (IN If) (S (NP-SBJ (PRP we)) (VP (VBD had) (VP (VP (VBN been) (PP-PRD (IN like) (NP (NP (DT a) (NNP Chicago)) (CC or) (NP (DT a) (NNP New) (NNP York) (NNP City)) (CC or) (NP (NNP Philadelphia)) (CC or) (NP (NP (NN someone)) (PP (IN like) (NP (DT that))))))) (, ,) (CC and) (VP (VBD had) (S (NP-SBJ (DT a) (JJ public) (NN transportation) (NN system)) (VP (VBG starting) (UCP-TMP (PP (IN in) (NP (DT the) (NN horse) (CC and) (NN buggy) (NNS days))) (CC and) (SBAR (WHADVP-1 (WRB when)) (S (S (NP-SBJ (NN land)) (VP (VBD was) (ADJP-PRD (JJ cheap)))) (CC and) (, ,) (INTJ (UH uh)) (, ,) (S (NP-SBJ (NN construction) (NNS costs)) (VP (VBD were) (ADJP-PRD (JJ cheap)) (ADVP-TMP (-NONE- *T*-1)))))))))))))) (, ,) (NP-SBJ (PRP you)) (VP (MD could) (VP (VB afford) (NP (PRP it)))) (. .) (-DFL- E_S)))","monomorphemic"
"151","43034:21","well, right now the place where i'm living *t*-1, the yard was basically neglected *-2 for about the last twenty-five years,","no","no","yes","relative","no","","","","","where","","","","was","neglected","","the","the","",NA,"(WRB where)","where i'm living *t*-1","(TOP (S (INTJ (UH Well)) (, ,) (ADVP-TMP (RB right) (RB now)) (NP-ADV (NP (DT the) (NN place)) (SBAR (WHADVP-1 (WRB where)) (S (NP-SBJ (PRP I)) (VP (VBP 'm) (VP (VBG living) (ADVP-LOC (-NONE- *T*-1))))))) (, ,) (NP-SBJ-2 (DT the) (NN yard)) (VP (VBD was) (ADVP (RB basically)) (VP (VBN neglected) (NP (-NONE- *-2)) (PP-TMP (IN for) (ADVP (RB about)) (NP (DT the) (JJ last) (CD twenty-five) (NNS years))))) (, ,) (-DFL- E_S)))","monomorphemic"
"152","37646:40","in other words if you've got a player on your team who *t*-1's helping your team, then * keep him there.","no","no","yes","relative","no","","","","","who","","","","'ve","got","","","a","",NA,"(WP who)","who *t*-1's helping your team","(TOP (S-IMP (PP (IN In) (NP (JJ other) (NNS words))) (SBAR-ADV (IN if) (S (NP-SBJ (PRP you)) (VP (VBP 've) (VP (VBN got) (NP (NP (DT a) (NN player)) (PP (IN on) (NP (PRP$ your) (NN team))) (SBAR (WHNP-1 (WP who)) (S (NP-SBJ (-NONE- *T*-1)) (VP (BES 's) (VP (VBG helping) (NP (PRP$ your) (NN team))))))))))) (, ,) (ADVP (RB then)) (NP-SBJ (-NONE- *)) (VP (VB keep) (NP (PRP him)) (ADVP-LOC (RB there))) (. .) (-DFL- E_S)))","monomorphemic"
"153","89023:10","but then when it started *t*-1, i just couldn't, you know, read.","no","no","yes","subject","no","","","","","when","","","","know","read","","","","",NA,"(WRB when)","when it started *t*-1","(TOP (S (CONJP (CC but) (RB then)) (SBAR-TMP (WHADVP-1 (WRB when)) (S (NP-SBJ (PRP it)) (VP (VBD started) (ADVP-TMP (-NONE- *T*-1))))) (, ,) (NP-SBJ (PRP I)) (ADVP (RB just)) (VP (MD could) (RB n't) (PRN (, ,) (S (NP-SBJ (PRP you)) (VP (VBP know))) (, ,)) (VP (VB read))) (. .) (-DFL- E_S)))","monomorphemic"
"154","146608:48","and that would be very difficult i think 0 *t*-4 0 for an adult who *t*-1 wasn't in that situation to to have *-3 to deal with *t*-2 on a daily basis.","no","no","yes","relative","no","","","","","who","difficult","","","have","have","","that","that","",NA,"(WP who)","who *t*-1 wasn't in that situation","(TOP (S-4 (CC and) (NP-SBJ (DT that)) (VP (MD would) (VP (VB be) (ADJP-PRD (RB very) (JJ difficult) (PRN (S (NP-SBJ (PRP I)) (VP (VBP think) (SBAR (-NONE- 0) (S (-NONE- *T*-4)))))) (SBAR (WHNP-2 (-NONE- 0)) (IN for) (S (NP-SBJ-3 (NP (DT an) (NN adult)) (SBAR (WHNP-1 (WP who)) (S (NP-SBJ (-NONE- *T*-1)) (VP (VBD was) (RB n't) (PP-PRD (IN in) (NP (DT that) (NN situation))))))) (EDITED (VP-UNF (TO to))) (VP (TO to) (VP (VB have) (S (NP-SBJ (-NONE- *-3)) (VP (TO to) (VP (VB deal) (PP (RB with) (NP (-NONE- *T*-2))) (PP-TMP (IN on) (NP (DT a) (JJ daily) (NN basis))))))))))))) (. .) (-DFL- E_S)))","monomorphemic"
"155","36140:45","and, uh, it helped me out because i learned things and learned how *-1 to do things differently *t*-2.","no","no","no","embedded","no","","","","","how","learned","","","learned","learned","","","","",NA,"(WRB how)","how *-1 to do things differently *t*-2","(TOP (S (CC And) (, ,) (INTJ (UH uh)) (, ,) (NP-SBJ (PRP it)) (VP (VBD helped) (NP (PRP me)) (PRT (RP out)) (SBAR-PRP (IN because) (S (NP-SBJ-1 (PRP I)) (VP (VP (VBD learned) (NP (NNS things))) (CC and) (VP (VBD learned) (SBAR (WHADVP-2 (WRB how)) (S (NP-SBJ (-NONE- *-1)) (VP (TO to) (VP (VB do) (NP (NNS things)) (ADVP-MNR (RB differently)) (ADVP-MNR (-NONE- *T*-2))))))))))) (. .) (-DFL- E_S)))","monomorphemic"
"156","91881:13","or * guess who our local sheriff,","no","no","yes","exclamation","no","","","","","who","guess","","","guess","","","","","",NA,"(WP who)","who our local sheriff","(TOP (S-IMP (CC or) (NP-SBJ (-NONE- *)) (VP (VB guess) (SBAR (WHNP (WP who)) (S-UNF (NP-SBJ (PRP$ our) (JJ local) (NN sheriff))))) (, ,) (-DFL- N_S)))","monomorphemic"
"157","71965:58","um, i don't see it as much, the, like in my situation where i don't, i don't have children yet *t*-1,","no","no","yes","relative","no","","","","","where","","","","do","see","","","the","",NA,"(WRB where)","where i don't, i don't have children yet *t*-1","(TOP (S (INTJ (UH um)) (, ,) (NP-SBJ (PRP I)) (VP (VBP do) (RB n't) (VP (VB see) (NP (PRP it)) (ADVP (RB as) (RB much)) (, ,) (EDITED (RM (-DFL- \[)) (NP-UNF (DT the)) (, ,) (IP (-DFL- \+)) (RS (-DFL- \]))) (INTJ (UH like)) (PP (IN in) (NP (NP (PRP$ my) (NN situation)) (SBAR (WHADVP-1 (WRB where)) (S (EDITED (RM (-DFL- \[)) (S (NP-SBJ (PRP I)) (VP-UNF (VBP do) (RB n't))) (, ,) (IP (-DFL- \+))) (NP-SBJ (PRP I)) (VP (VBP do) (RB n't) (RS (-DFL- \])) (VP (VB have) (NP (NNS children)) (ADVP-TMP (RB yet)) (ADVP (-NONE- *T*-1)))))))))) (, ,) (-DFL- E_S)))","monomorphemic"
"158","149087:50","i used *t*-1 to use a, just an apple two e, which of course *t*-2 is looks pretty primitive now.","no","no","yes","relative","no","","","","","which","used","","","use","use","","","which","",NA,"(WDT which)","which of course *t*-2 is looks pretty primitive now","(TOP (S (NP-SBJ-1 (PRP I)) (VP (VBD used) (S (NP-SBJ (-NONE- *T*-1)) (VP (TO to) (VP (VB use) (EDITED (RM (-DFL- \[)) (NP-UNF (DT a)) (, ,) (IP (-DFL- \+))) (NP (NP (RB just) (DT an) (RS (-DFL- \])) (NNP Apple) (CD two) (NNP E)) (, ,) (SBAR (WHNP-2 (WDT which)) (S (PP (IN of) (NP (NN course))) (NP-SBJ (-NONE- *T*-2)) (EDITED (RM (-DFL- \[)) (VP-UNF (VBZ is)) (IP (-DFL- \+))) (VP (VBZ looks) (RS (-DFL- \])) (ADJP-PRD (RB pretty) (JJ primitive)) (ADVP-TMP (RB now)))))))))) (. .) (-DFL- E_S)))","monomorphemic"
"159","99143:62","because i had so many friends who *t*-1 did go from our small school to university of michigan, which *t*-2 was so large","no","no","yes","relative","no","","","","","which","","","","did","go","","","which","",NA,"(WDT which)","which *t*-2 was so large","(TOP (SBAR-PRP (IN because) (S (NP-SBJ (PRP I)) (VP (VBD had) (NP (NP (RB so) (JJ many) (NNS friends)) (SBAR (WHNP-1 (WP who)) (S (NP-SBJ (-NONE- *T*-1)) (VP (VBD did) (VP (VB go) (PP (IN from) (NP (PRP$ our) (JJ small) (NN school))) (PP (IN to) (NP (NP (NP (NNP University)) (PP (IN of) (NP (NNP Michigan)))) (, ,) (SBAR (WHNP-2 (WDT which)) (S (NP-SBJ (-NONE- *T*-2)) (VP (VBD was) (ADJP-PRD (RB so) (JJ large)))))))))))))) (-DFL- E_S)))","monomorphemic"
"160","53986:21","well, well, that's what i meant *t*-1 by salt that we, we did that like as a family, little ornaments and, things like that, and just kind of really got into it. like during the christmas season, *-2 making them up for other people and things like that.","no","no","yes","subject","no","","","","","what","'s","","","meant","","","that","that","",NA,"(WP what)","what i meant *t*-1 by salt","(TOP (S (INTJ (UH Well)) (, ,) (INTJ (UH well)) (, ,) (NP-SBJ (DT that)) (VP (BES 's) (SBAR-NOM-PRD (WHNP-1 (WP what)) (S (NP-SBJ (PRP I)) (VP (VBD meant) (NP (-NONE- *T*-1)) (PP (IN by) (NP (NN salt)))))) (SBAR (IN that) (S (EDITED (RM (-DFL- \[)) (NP-SBJ (PRP we)) (, ,) (IP (-DFL- \+))) (NP-SBJ-2 (PRP we)) (RS (-DFL- \])) (VP (VP (VBD did) (NP (DT that)) (INTJ (UH like)) (PP (IN as) (NP (DT a) (NN family))) (, ,) (NP-TPC (NP (JJ little) (NNS ornaments)) (CC and) (, ,) (NP (NP (NNS things)) (PP (IN like) (NP (DT that)))))) (, ,) (CC and) (VP (ADVP (RB just)) (ADVP (RB kind) (RB of)) (ADVP (RB really)) (VBD got) (PP (IN into) (NP (PRP it))) (. .) (INTJ (UH Like)) (PP-TMP (IN during) (NP (DT the) (NNP Christmas) (NN season)))) (, ,) (S-ADV (NP-SBJ (-NONE- *-2)) (VP (VP (VBG making) (NP (PRP them)) (PRT (RP up)) (PP (IN for) (NP (JJ other) (NNS people)))) (CC and) (NP-ETC (NP (NNS things)) (PP (IN like) (NP (DT that)))))))))) (. .) (-DFL- E_S)))","monomorphemic"
"161","937:75","well, i guess, 0 although, i, well, that's a good point where you said that how does one define what invasion of privacy is *t*-1 *t*-3 *t*-2, because, uh, if that's the case of a tree falling in the forest","no","no","yes","relative","no","yes","","one","","how","said","","","said","","","that","that","",NA,"(WRB how)","how does one define what invasion of privacy is *t*-1 *t*-3","(TOP (S (INTJ (UH Well)) (, ,) (NP-SBJ (PRP I)) (VP (VBP guess) (, ,) (SBAR (-NONE- 0) (S (ADVP (IN although)) (, ,) (EDITED (RM (-DFL- \[)) (NP-SBJ (PRP I)) (, ,) (IP (-DFL- \+)) (RS (-DFL- \]))) (INTJ (UH well)) (, ,) (NP-SBJ (DT that)) (VP (BES 's) (NP-PRD (NP (DT a) (JJ good) (NN point)) (SBAR (WHADVP-2 (WRB where)) (S (NP-SBJ (PRP you)) (VP (VBD said) (SBAR (IN that) (SBARQ (WHADVP-3 (WRB how)) (SQ (VBZ does) (NP-SBJ (NN one)) (VP (VB define) (SBAR-NOM (WHNP-1 (WP what)) (S (NP-SBJ (NP (NN invasion)) (PP (IN of) (NP (NN privacy)))) (VP (VBZ is) (NP-PRD (-NONE- *T*-1))))) (ADVP-MNR (-NONE- *T*-3)))))) (ADVP (-NONE- *T*-2)))))) (, ,) (SBAR-PRP (IN because) (, ,) (S-UNF (INTJ (UH uh)) (, ,) (SBAR-ADV (IN if) (S (NP-SBJ (DT that)) (VP (BES 's) (NP-PRD (NP (DT the) (NN case)) (PP (IN of) (NP (NP (DT a) (NN tree)) (VP (VBG falling) (PP-LOC (IN in) (NP (DT the) (NN forest)))))))))))))))) (-DFL- E_S)))","monomorphemic"
"162","14742:5","what you're doing *t*-1 is, 0 you, you know,","no","no","yes","subject","no","","","","","","","","","is","","","","","",NA,"(WP What)","what you're doing *t*-1","(TOP (S (SBAR-NOM-SBJ (WHNP-1 (WP What)) (S (NP-SBJ (PRP you)) (VP (VBP 're) (VP (VBG doing) (NP (-NONE- *T*-1)))))) (VP (VBZ is) (, ,) (SBAR-PRD (-NONE- 0) (S-UNF (NP-SBJ (PRP you)) (PRN (, ,) (S (NP-SBJ (PRP you)) (VP (VBP know))))))) (, ,) (-DFL- N_S)))","monomorphemic"
"163","103795:25","my oldest is getting to the point where he likes certain types of music and favorite songs *t*-1","no","no","yes","relative","no","","","","","where","","","","is","getting","","","the","",NA,"(WRB where)","where he likes certain types of music and favorite songs *t*-1","(TOP (S (NP-SBJ (PRP$ my) (JJS oldest)) (VP (VBZ is) (VP (VBG getting) (PP (IN to) (NP (NP (DT the) (NN point)) (SBAR (WHADVP-1 (WRB where)) (S (NP-SBJ (PRP he)) (VP (VBZ likes) (NP (NP (NP (JJ certain) (NNS types)) (PP (IN of) (NP (NN music)))) (CC and) (NP (JJ favorite) (NNS songs))) (ADVP (-NONE- *T*-1)))))))))))","monomorphemic"
"164","154339:19","and so we could see where every penny went *t*-1","no","no","yes","embedded","no","","","every","","where","see","","","see","see","","every","every","",NA,"(WRB where)","where every penny went *t*-1","(TOP (S (CONJP (CC and) (RB so)) (NP-SBJ (PRP we)) (VP (MD could) (VP (VB see) (SBAR (WHADVP-1 (WRB where)) (S (NP-SBJ (DT every) (NN penny)) (VP (VBD went) (ADVP (-NONE- *T*-1))))))) (-DFL- E_S)))","monomorphemic"
"165","131715:78","and my mother who *t*-1 is now, he's, my stepfather is dead, but my mother who *t*-2 is now seventy-one, i can remember her being, i believe *rnr*-4 a sixteen *rnr*-3 or a fourteen *rnr*-3 handicap,","no","no","yes","relative","no","","","","seventy-one","who","","","","remember","remember","","","a","",NA,"(WP who)","who *t*-2 is now seventy-one","(TOP (S (EDITED (RM (-DFL- \[)) (CC And) (NP-TPC (NP (PRP$ my) (NN mother)) (SBAR (WHNP-1 (WP who)) (S (NP-SBJ (-NONE- *T*-1)) (VP-UNF (VBZ is) (ADVP-TMP (RB now)))))) (, ,) (IP (-DFL- \+))) (PRN (S (EDITED (RM (-DFL- \[)) (S (NP-SBJ (PRP he)) (VP-UNF (BES 's))) (, ,) (IP (-DFL- \+))) (NP-SBJ (PRP$ my) (NN stepfather)) (VP (VBZ is) (RS (-DFL- \])) (ADJP-PRD (JJ dead)))) (, ,) (CC but)) (NP-TPC (NP (PRP$ my) (NN mother)) (SBAR (WHNP-2 (WP who)) (S (NP-SBJ (-NONE- *T*-2)) (VP (VBZ is) (ADVP-TMP (RB now)) (NP-PRD (CD seventy-one)))))) (, ,) (RS (-DFL- \])) (NP-SBJ (PRP I)) (VP (MD can) (VP (VB remember) (S (NP-SBJ (PRP her)) (VP (VBG being) (PRN (, ,) (S (NP-SBJ (PRP I)) (VP (VBP believe) (FRAG (NP (-NONE- *RNR*-4)))))) (NP-PRD-4 (NP (DT a) (CD sixteen) (NX (-NONE- *RNR*-3))) (CC or) (NP (DT a) (CD fourteen) (NX (-NONE- *RNR*-3))) (NX-3 (NN handicap))))))) (, ,) (-DFL- E_S)))","monomorphemic"
