"","Item_ID","Sentence","ModalPresent","HaveNeedTo","Finite","QuestionType","DegreeQ","SubjectAuxInv","WhAll","QuantifiedSubject","QuantifiedPredicate","Wh","MatVerb","MatVerbPart","Modal","Verb1","Verb2","Verb3","DeterminerSubject","DeterminerNonSubject","FullWhPhrase","WhNode","WhParse","Question","SentenceParse","WhPhaseType"
"1","38848:19","you get so involved in what you're reading *t*-1.","no","no","yes","nominalized","no","","","","","what","","involved","","get","","","","","",NA,"(WP what)","what you're reading *t*-1","(TOP (S (NP-SBJ (PRP You)) (VP (VBP get) (ADJP-PRD (RB so) (JJ involved) (PP (IN in) (SBAR-NOM (WHNP-1 (WP what)) (S (NP-SBJ (PRP you)) (VP (VBP 're) (VP (VBG reading) (NP (-NONE- *T*-1))))))))) (. .) (-DFL- E_S)))","monomorphemic"
"2","47489:12","this is how much *ich*-2 i know *t*-1 about baseball.","no","no","yes","embedded","yes","","","","baseball","how","is","","","is","","","this","","how much *ich*-2",NA,"(WRB how)","how much *ich*-2 i know *t*-1 about baseball","(TOP (S (NP-SBJ (DT This)) (VP (VBZ is) (SBAR-PRD (WHNP-1 (WHNP (WRB how) (RB much)) (PP (-NONE- *ICH*-2))) (S (NP-SBJ (PRP I)) (VP (VBP know) (NP (-NONE- *T*-1)) (PP-2 (IN about) (NP (NN baseball))))))) (. .) (-DFL- E_S)))","complex"
"3","39293:4","what is, uh, is a marsala wine *t*-1","no","no","yes","root","no","yes","","","","","","","","","","","a","","",NA,"(WP What)","what is, uh, is a marsala wine *t*-1","(TOP (SBARQ (WHNP-1 (WP What)) (EDITED (RM (-DFL- \[)) (SQ-UNF (VBZ is)) (, ,) (IP (-DFL- \+))) (INTJ (UH uh)) (, ,) (SQ (VBZ is) (RS (-DFL- \])) (NP-SBJ (DT a) (NN marsala) (NN wine)) (NP-PRD (-NONE- *T*-1)))))","monomorphemic"
"4","40969:101","and it showed who my, uh, well, who my husband's parents were *t*-1, you know. and, who he married *t*-2 and then how many children we had *t*-3 and then like his brothers and sisters","no","no","yes","relative","yes","","","","","how","","","","showed","","","","","how many children",NA,"(WRB how)","how many children we had *t*-3","(TOP (S (CC and) (NP-SBJ (PRP it)) (VP (VBD showed) (NP (SBAR-NOM (EDITED (RM (-DFL- \[)) (SBAR (WHNP (WP who)) (S (NP-SBJ-UNF (PRP$ my)))) (, ,) (IP (-DFL- \+))) (INTJ (UH uh)) (, ,) (INTJ (UH well)) (, ,) (WHNP-1 (WP who)) (S (NP-SBJ (NP (PRP$ my) (RS (-DFL- \])) (NN husband) (POS 's)) (NNS parents)) (VP (VBD were) (NP-PRD (-NONE- *T*-1)))) (PRN (, ,) (S (NP-SBJ (PRP you)) (VP (VBP know))) (. .))) (CC And) (, ,) (SBAR-NOM (WHNP-2 (WP who)) (S (NP-SBJ (PRP he)) (VP (VBD married) (NP (-NONE- *T*-2))))) (CONJP (CC and) (RB then)) (SBAR-NOM (WHNP-3 (WHADJP (WRB how) (JJ many)) (NNS children)) (S (NP-SBJ (PRP we)) (VP (VBD had) (NP (-NONE- *T*-3))))) (CONJP (CC and) (RB then)) (INTJ (UH like)) (NP (PRP$ his) (NNS brothers) (CC and) (NNS sisters)))) (-DFL- E_S)))","complex"
"5","136355:31","i mean, you got *-1 to wonder how long they're going *-2 to keep *-3 doing that for *t*-4.","no","no","yes","embedded","yes","","","","","how","wonder","","","wonder","wonder","","","that","how long",NA,"(WRB how)","how long they're going *-2 to keep *-3 doing that for *t*-4","(TOP (S (PRN (S (NP-SBJ (PRP I)) (VP (VBP mean))) (, ,)) (NP-SBJ-1 (PRP you)) (VP (VBN got) (S (NP-SBJ (-NONE- *-1)) (VP (TO to) (VP (VB wonder) (SBAR (WHADVP-4 (WRB how) (JJ long)) (S (NP-SBJ-2 (PRP they)) (VP (VBP 're) (VP (VBG going) (S (NP-SBJ-3 (-NONE- *-2)) (VP (TO to) (VP (VB keep) (S (NP-SBJ (-NONE- *-3)) (VP (VBG doing) (NP (DT that)) (PP-TMP (IN for) (ADVP (-NONE- *T*-4)))))))))))))))) (. .) (-DFL- E_S)))","complex"
"6","11141:15","i think 0 what *t*-1 started it at work was that planet earth thing 0 we had *t*-2 last year.","no","no","yes","embedded","no","","","","","what","think","","","was","","","","that","",NA,"(WP what)","what *t*-1 started it at work","(TOP (S (NP-SBJ (PRP I)) (VP (VBP think) (SBAR (-NONE- 0) (S (SBAR-NOM-SBJ (WHNP-1 (WP what)) (S (NP-SBJ (-NONE- *T*-1)) (VP (VBD started) (NP (PRP it)) (PP-LOC (IN at) (NP (NN work)))))) (VP (VBD was) (NP-PRD (NP (DT that) (NN planet) (NN earth) (NN thing)) (SBAR (WHNP-2 (-NONE- 0)) (S (NP-SBJ (PRP we)) (VP (VBD had) (NP (-NONE- *T*-2)) (NP-TMP (JJ last) (NN year)))))))))) (. .) (-DFL- E_S)))","monomorphemic"
"7","108484:49","you can't understand what they're saying *t*-1 on some of those songs which *t*-2 probably is just as well on some of them, too.","no","no","yes","embadjunct","no","","","","some","which","","","","understand","","understand","","which","",NA,"(WDT which)","which *t*-2 probably is just as well on some of them, too","(TOP (S (NP-SBJ (PRP you)) (VP (MD ca) (RB n't) (VP (VP (VB understand) (SBAR (WHNP-1 (WP what)) (S (NP-SBJ (PRP they)) (VP (VBP 're) (VP (VBG saying) (NP (-NONE- *T*-1))))))) (PP (IN on) (NP (NP (DT some)) (PP (IN of) (NP (DT those) (NNS songs))))) (SBAR (WHNP-2 (WDT which)) (S (NP-SBJ (-NONE- *T*-2)) (ADVP (RB probably)) (VP (VBZ is) (ADVP-PRD (RB just) (RB as) (RB well)) (PP (IN on) (NP (NP (DT some)) (PP (IN of) (NP (PRP them))))) (, ,) (ADVP (RB too))))))) (. .) (-DFL- E_S)))","monomorphemic"
"8","114629:41","i worked on my airline apollo focal point computer for about four years. which *t*-1 was different.","no","no","yes","embadjunct","no","","","","","","","","","worked","worked","","","which","",NA,"(WDT Which)","which *t*-1 was different","(TOP (S (NP-SBJ (PRP I)) (VP (VP (VBD worked) (PP (IN on) (NP (PRP$ my) (NN airline) (NNP Apollo) (NNP Focal) (NNP Point) (NN computer))) (PP-TMP (IN for) (NP (QP (RB about) (CD four)) (NNS years)))) (. .) (SBAR (WHNP-1 (WDT Which)) (S (NP-SBJ (-NONE- *T*-1)) (VP (VBD was) (ADJP-PRD (JJ different)))))) (. .) (-DFL- E_S)))","monomorphemic"
"9","176112:63","and, and we put twenty-eight hundred dollars on the charge. along with my trip to japan which *t*-1 was, was fourteen or fifteen hundred dollars","no","no","yes","relative","no","","","","","which","","","","put","","","","which","",NA,"(WDT which)","which *t*-1 was, was fourteen or fifteen hundred dollars","(TOP (S (EDITED (RM (-DFL- \[)) (CC And) (, ,) (IP (-DFL- \+))) (CC and) (RS (-DFL- \])) (NP-SBJ (PRP we)) (VP (VBD put) (NP (QP (CD twenty-eight) (CD hundred)) (NNS dollars)) (PP-PUT (IN on) (NP (DT the) (NN charge))) (. .) (PP (IN Along) (PP (IN with) (NP (NP (PRP$ my) (NN trip)) (PP (IN to) (NP (NNP Japan))) (SBAR (WHNP-1 (WDT which)) (S (NP-SBJ (-NONE- *T*-1)) (EDITED (RM (-DFL- \[)) (VP-UNF (VBD was)) (, ,) (IP (-DFL- \+))) (VP (VBD was) (RS (-DFL- \])) (NP-PRD (QP (CD fourteen) (CC or) (CD fifteen) (CD hundred)) (NNS dollars))))))))) (-DFL- E_S)))","monomorphemic"
"10","2846:34","the blue flu, or the white collar flu, depending on where you work *t*-1, i guess.","no","no","yes","nominalized","no","","","","","where","","depending","","","","","","","",NA,"(WRB where)","where you work *t*-1","(TOP (FRAG (NP (NP (DT the) (JJ blue) (NN flu)) (, ,) (CC or) (NP (DT the) (JJ white) (NN collar) (NN flu))) (, ,) (PP (VBG depending) (PP (IN on) (SBAR-NOM (WHADVP-1 (WRB where)) (S (NP-SBJ (PRP you)) (VP (VBP work) (ADVP-LOC (-NONE- *T*-1))))))) (PRN (, ,) (S (NP-SBJ (PRP I)) (VP (VBP guess)))) (. .) (-DFL- E_S)))","monomorphemic"
"11","62698:64","attitude is, is * just get me my dollar so i can go *-3 do what i want *-1 to do *t*-2, and, mumblex on,","no","no","yes","nominalized","no","","","","","what","do","","","do","go","","","","",NA,"(WP what)","what i want *-1 to do *t*-2, and, mumblex on","(TOP (S (NP-SBJ (NN Attitude)) (EDITED (RM (-DFL- \[)) (VP-UNF (VBZ is)) (, ,) (IP (-DFL- \+))) (VP (VBZ is) (RS (-DFL- \])) (S-PRD (NP-SBJ (-NONE- *)) (ADVP (RB just)) (VP (VB get) (NP-BNF (PRP me)) (NP (PRP$ my) (NN dollar)) (SBAR-PRP (IN so) (S (NP-SBJ-3 (PRP I)) (VP (MD can) (VP (VB go) (S (NP-SBJ (-NONE- *-3)) (VP (VB do) (SBAR-NOM (WHNP-2 (WP what)) (S (NP-SBJ-1 (PRP I)) (VP (VBP want) (S (NP-SBJ (-NONE- *-1)) (VP (TO to) (VP (VB do) (NP (-NONE- *T*-2)) (, ,) (X (CC and) (, ,) (X (XX MUMBLEx)) (PP-UNF (IN on)))))))))))))))))) (, ,) (-DFL- E_S)))","monomorphemic"
"12","99082:20","did you base it on what you wanted *-1 to major in *t*-2 or what you would feel comfortable with *t*-3 or what you could afford *t*-4","no","no","yes","nominalized","no","","","","","what","","base","","base","","","","","",NA,"(WP what)","what you wanted *-1 to major in *t*-2","(TOP (SQ (VBD Did) (NP-SBJ (PRP you)) (VP (VBP base) (NP (PRP it)) (PP (IN on) (SBAR-NOM (SBAR (WHNP-2 (WP what)) (S (NP-SBJ-1 (PRP you)) (VP (VBD wanted) (S (NP-SBJ (-NONE- *-1)) (VP (TO to) (VP (VB major) (PP (IN in) (NP (-NONE- *T*-2))))))))) (CC or) (SBAR (WHNP-3 (WP what)) (S (NP-SBJ (PRP you)) (VP (MD would) (VP (VB feel) (ADJP-PRD (JJ comfortable) (PP (IN with) (NP (-NONE- *T*-3)))))))) (CC or) (SBAR (WHNP-4 (WP what)) (S (NP-SBJ (PRP you)) (VP (MD could) (VP (VB afford) (NP (-NONE- *T*-4))))))))) (-DFL- E_S)))","monomorphemic"
"13","101647:9","so, when we're here at home, you know, with sweets and stuff *t*-1, they, they don't, we don't really do that much.","no","no","yes","subject","no","","","","","when","","","","do","do","","","that","",NA,"(WRB when)","when we're here at home, you know, with sweets and stuff *t*-1","(TOP (S (RB So) (, ,) (SBAR-TMP (WHADVP-1 (WRB when)) (S (NP-SBJ (PRP we)) (VP (VBP 're) (ADVP-LOC-PRD (RB here) (PP (IN at) (NP (NN home)))) (PRN (, ,) (S (NP-SBJ (PRP you)) (VP (VBP know))) (, ,)) (PP (IN with) (NP (NNS sweets) (CC and) (NN stuff))) (ADVP-TMP (-NONE- *T*-1))))) (, ,) (EDITED (RM (-DFL- \[)) (EDITED (RM (-DFL- \[)) (NP-SBJ (PRP they)) (, ,) (IP (-DFL- \+))) (S (NP-SBJ (PRP they)) (VP-UNF (VBP do) (RB n't))) (, ,) (RS (-DFL- \])) (IP (-DFL- \+))) (NP-SBJ (PRP we)) (VP (VBP do) (RB n't) (RS (-DFL- \])) (ADVP (RB really)) (VP (VB do) (NP (ADJP (DT that) (RB much))))) (. .) (-DFL- E_S)))","monomorphemic"
"14","85013:25","and * passing the law depends on how heavy the car industry, the automobile lobby is *t*-1.","no","no","yes","subject","yes","","","","","how","","depends","","depends","","","the","the","how heavy",NA,"(WRB how)","how heavy the car industry, the automobile lobby is *t*-1","(TOP (S (CC and) (S-NOM-SBJ (NP-SBJ (-NONE- *)) (VP (VBG passing) (NP (DT the) (NN law)))) (VP (VBZ depends) (PP (IN on) (SBAR (WHADJP-1 (WRB how) (JJ heavy)) (S (EDITED (RM (-DFL- \[)) (NP-SBJ (DT the) (NN car) (NN industry)) (, ,) (IP (-DFL- \+))) (NP-SBJ (DT the) (NN automobile) (NN lobby)) (RS (-DFL- \])) (VP (VBZ is) (ADJP-PRD (-NONE- *T*-1))))))) (. .) (-DFL- E_S)))","complex"
"15","55373:15","and the governments, which our government has technically supported *t*-1 for years, are corrupt as all get out.","no","no","yes","relative","no","","","","technically","which","","","","are","","","which","","",NA,"(WDT which)","which our government has technically supported *t*-1 for years","(TOP (S (CC and) (NP-SBJ (NP (DT the) (NNS governments)) (, ,) (SBAR (WHNP-1 (WDT which)) (S (NP-SBJ (PRP$ our) (NN government)) (VP (VBZ has) (ADVP (RB technically)) (VP (VBN supported) (NP (-NONE- *T*-1)) (PP-TMP (IN for) (NP (NNS years)))))))) (, ,) (VP (VBP are) (ADJP-PRD (ADJP (JJ corrupt)) (PP (IN as) (NP (RB all) (VB get) (IN out))))) (. .) (-DFL- E_S)))","monomorphemic"
"16","90979:30","though i would put it on my resume, what program i went to *t*-1.","no","no","yes","embedded","no","","","","","what","put","","","put","put","","","what","what program",NA,"(WDT what)","what program i went to *t*-1","(TOP (S (ADVP (IN though)) (NP-SBJ (PRP I)) (VP (MD would) (VP (VB put) (NP (PRP it)) (PP-PUT (IN on) (NP (PRP$ my) (NN resume))) (, ,) (SBAR-TPC (WHNP-1 (WDT what) (NN program)) (S (NP-SBJ (PRP I)) (VP (VBD went) (PP (IN to) (NP (-NONE- *T*-1)))))))) (. .) (-DFL- E_S)))","complex"
"17","171297:23","so. and i don't know what *t*-1's going *-2 to happen.","no","no","yes","embedded","no","","","","","what","know","","","do","know","","","","",NA,"(WP what)","what *t*-1's going *-2 to happen","(TOP (S (INTJ (UH So)) (. .) (CC And) (NP-SBJ (PRP I)) (VP (VBP do) (RB n't) (VP (VB know) (SBAR (WHNP-1 (WP what)) (S (NP-SBJ-2 (-NONE- *T*-1)) (VP (BES 's) (VP (VBG going) (S (NP-SBJ (-NONE- *-2)) (VP (TO to) (VP (VB happen)))))))))) (. .) (-DFL- E_S)))","monomorphemic"
"18","63057:33","i find, too, that i have more energy when i exercise *t*-1,","no","no","yes","embedded","no","","","","","when","have","","","have","","","","","",NA,"(WRB when)","when i exercise *t*-1","(TOP (S (NP-SBJ (PRP I)) (VP (VBP find) (, ,) (ADVP (RB too)) (, ,) (SBAR (IN that) (S (NP-SBJ (PRP I)) (VP (VBP have) (NP (JJR more) (NN energy)) (SBAR-TMP (WHADVP-1 (WRB when)) (S (NP-SBJ (PRP I)) (VP (VBP exercise) (ADVP-TMP (-NONE- *T*-1))))))))) (, ,) (-DFL- E_S)))","monomorphemic"
"19","141977:14","it's just whenever we're, um.","no","no","yes","embedded","no","","","","","whenever","'s","","","'re","","","","","",NA,"(WRB whenever)","whenever we're, um","(TOP (S (NP-SBJ (PRP it)) (VP (BES 's) (ADVP (RB just)) (SBAR-TMP-PRD (WHADVP (WRB whenever)) (S (NP-SBJ (PRP we)) (VP-UNF (VBP 're) (, ,) (INTJ (UH um)))))) (. .) (-DFL- N_S)))","monomorphemic"
"20","33118:47","it jus- i- it just depends on what type it was *t*-1 i guess 0 *t*-2","no","no","yes","nominalized","no","","","","","what","","depends","","depends","","","","","what type",NA,"(WP what)","what type it was *t*-1","(TOP (S (S-TPC-2 (EDITED (RM (-DFL- \[)) (NP-SBJ (PRP it)) (ADVP-UNF (RB jus-)) (IP (-DFL- \+))) (EDITED (RM (-DFL- \[)) (NP-UNF-SBJ (PRP i-)) (IP (-DFL- \+))) (NP-SBJ (PRP it)) (RS (-DFL- \])) (ADVP (RB just)) (RS (-DFL- \])) (VP (VBZ depends) (PP (IN on) (SBAR-NOM (WHNP-1 (WP what) (NN type)) (S (NP-SBJ (PRP it)) (VP (VBD was) (NP-PRD (-NONE- *T*-1)))))))) (NP-SBJ (PRP I)) (VP (VBP guess) (SBAR (-NONE- 0) (S (-NONE- *T*-2)))) (-DFL- E_S)))","complex"
"21","170332:108","because when it come down to layoff *t*-1, they don't really consider people and, and, you know, their well being as far as, you know, how they going, their next dollar going *-3 to come in *t*-2. how they going *-4 to pay their bills *t*-5.","no","no","yes","adjunct","no","","","","","how","","","","do","consider","","","","",NA,"(WRB how)","how they going, their next dollar going *-3 to come in *t*-2","(TOP (SBAR-PRP (IN Because) (S (SBAR-TMP (WHADVP-1 (WRB when)) (S (NP-SBJ (PRP it)) (VP (VBP come) (PP (RP down) (PP (IN to) (NP (NN layoff)))) (ADVP-TMP (-NONE- *T*-1))))) (, ,) (NP-SBJ (PRP they)) (VP (VBP do) (RB n't) (ADVP (RB really)) (VP (VB consider) (NP (NP (NNS people)) (EDITED (RM (-DFL- \[)) (CC and) (, ,) (IP (-DFL- \+))) (CC and) (, ,) (RS (-DFL- \])) (PRN (S (NP-SBJ (PRP you)) (VP (VBP know))) (, ,)) (NP (PRP$ their) (GW well) (^NN being))) (ADVP (ADVP (RB as) (RB far)) (PP (IN as) (PRN (, ,) (S (NP-SBJ (PRP you)) (VP (VBP know))) (, ,)) (SBAR-NOM (SBAR (WHADVP-2 (WRB how)) (S (EDITED (RM (-DFL- \[)) (S (NP-SBJ (PRP they)) (VP-UNF (VBG going))) (, ,) (IP (-DFL- \+))) (NP-SBJ-3 (PRP$ their) (JJ next) (NN dollar)) (VP (VBG going) (RS (-DFL- \])) (S (NP-SBJ (-NONE- *-3)) (VP (TO to) (VP (VB come) (ADVP-DIR (RB in)) (ADVP-MNR (-NONE- *T*-2)))))))) (. .) (-DFL- E_S) (SBAR (WHADVP-5 (WRB How)) (S (NP-SBJ-4 (PRP they)) (VP (VBG going) (S (NP-SBJ (-NONE- *-4)) (VP (TO to) (VP (VB pay) (NP (PRP$ their) (NNS bills)) (ADVP-MNR (-NONE- *T*-5)))))))))))))) (. .) (-DFL- E_S)))","monomorphemic"
"22","144582:4","what do you think *t*-1 about that?","no","no","yes","root","no","yes","","","","what","","","","","","","","that","",NA,"(WP what)","what do you think *t*-1 about that?","(TOP (SBARQ (WHNP-1 (WP what)) (SQ (VBP do) (NP-SBJ (PRP you)) (VP (VB think) (NP (-NONE- *T*-1)) (PP (IN about) (NP (DT that))))) (. ?) (-DFL- E_S)))","monomorphemic"
"23","95636:41","and, it *exp*-1 was just, uh, fascinating * to see how little things cost *t*-2,","no","no","yes","embedded","yes","","","","","how","see","","","see","see","","","","how little",NA,"(WRB how)","how little things cost *t*-2","(TOP (S (CC And) (, ,) (NP-SBJ (NP (PRP it)) (S (-NONE- *EXP*-1))) (VP (VBD was) (ADJP-PRD (RB just) (, ,) (INTJ (UH uh)) (, ,) (JJ fascinating)) (S-1 (NP-SBJ (-NONE- *)) (VP (TO to) (VP (VB see) (SBAR (WHNP-2 (WRB how) (JJ little)) (S (NP-SBJ (NNS things)) (VP (VBP cost) (NP (-NONE- *T*-2))))))))) (, ,) (-DFL- E_S)))","complex"
"24","171379:92","but people who *t*-4 d-, don't have day in and day out life long experience with what prison is really like *t*-1 and what the options are *t*-2, * to ask them *-3 to decide for one case, on one person, based on what they see *t*-5, i think 0 that is maybe, uh, a little bit naive.","no","no","yes","relative","no","","","","","what","","","","do","have","","the","the","",NA,"(WP what)","what the options are *t*-2","(TOP (S (CC But) (S-TPC (NP-TPC (NP (NNS people)) (SBAR (WHNP-4 (WP who)) (S (NP-SBJ (-NONE- *T*-4)) (EDITED (RM (-DFL- \[)) (VP-UNF (VBP d-)) (, ,) (IP (-DFL- \+))) (VP (VBP do) (RB n't) (RS (-DFL- \])) (VP (VB have) (NP (NP (NAC (NN day) (ADVP (IN in))) (CC and) (NAC (NN day) (ADVP (IN out))) (TYPO (GW life) (^JJ long)) (NN experience)) (PP (IN with) (NP (SBAR-NOM (WHNP-1 (WP what)) (S (NP-SBJ (NN prison)) (VP (VBZ is) (ADVP (RB really)) (PP-PRD (IN like) (NP (-NONE- *T*-1)))))) (CC and) (SBAR-NOM (WHNP-2 (WP what)) (S (NP-SBJ (DT the) (NNS options)) (VP (VBP are) (NP-PRD (-NONE- *T*-2))))))))))))) (, ,) (NP-SBJ (-NONE- *)) (VP (TO to) (VP (VB ask) (NP-3 (PRP them)) (S (NP-SBJ (-NONE- *-3)) (VP (TO to) (VP (VB decide) (PP (IN for) (NP (CD one) (NN case))) (, ,) (PP (IN on) (NP (CD one) (NN person))) (, ,) (PP (VBN based) (PP (IN on) (SBAR (WHNP-5 (WP what)) (S (NP-SBJ (PRP they)) (VP (VBP see) (NP (-NONE- *T*-5))))))))))))) (, ,) (NP-SBJ (PRP I)) (VP (VBP think) (SBAR (-NONE- 0) (S (NP-SBJ (DT that)) (VP (VBZ is) (ADVP (RB maybe)) (, ,) (INTJ (UH uh)) (, ,) (ADJP-PRD (NP-ADV (DT a) (JJ little) (NN bit)) (JJ naive)))))) (. .) (-DFL- E_S)))","monomorphemic"
"25","58645:18","my dad wouldn't know what * to do *t*-1.","no","no","no","embedded","no","","","","","what","know","","","know","know","","","","",NA,"(WP what)","what * to do *t*-1","(TOP (S (NP-SBJ (PRP$ My) (NN dad)) (VP (MD would) (RB n't) (VP (VB know) (SBAR (WHNP-1 (WP what)) (S (NP-SBJ (-NONE- *)) (VP (TO to) (VP (VB do) (NP (-NONE- *T*-1)))))))) (. .) (-DFL- E_S)))","monomorphemic"
"26","52408:4","what *t*-2's the one that *t*-1 just,","no","no","yes","root","no","yes","","","one","what","","","","","","","","the","",NA,"(WP what)","what *t*-2's the one that *t*-1 just,","(TOP (SBARQ (WHNP-2 (WP what)) (SQ (NP-SBJ (-NONE- *T*-2)) (VP (BES 's) (NP-PRD (NP (DT the) (CD one)) (SBAR (WHNP-1 (WDT that)) (S-UNF (NP-SBJ (-NONE- *T*-1)) (ADVP (RB just))))))) (, ,) (-DFL- N_S)))","monomorphemic"
"27","60332:22","um, i had a friend who *t*-1 went to colombia","no","no","yes","relative","no","","","","","who","","","","had","","","","a","",NA,"(WP who)","who *t*-1 went to colombia","(TOP (S (INTJ (UH Um)) (, ,) (NP-SBJ (PRP I)) (VP (VBD had) (NP (NP (DT a) (NN friend)) (SBAR (WHNP-1 (WP who)) (S (NP-SBJ (-NONE- *T*-1)) (VP (VBD went) (PP (IN to) (NP (NNP Colombia)))))))) (-DFL- E_S)))","monomorphemic"
"28","171090:40","and you have *-1 to get a feel for, uh, how they treat the kids *t*-2 and, uh, uh, what kind of staff members they have *t*-3 and how much turnover they have *t*-4 and things like that before you commit your child to them.","no","no","yes","subject","no","","","","","how","have","","","get","get","","","the","",NA,"(WRB how)","how they treat the kids *t*-2","(TOP (S (CC and) (NP-SBJ-1 (PRP you)) (VP (VBP have) (S (NP-SBJ (-NONE- *-1)) (VP (TO to) (VP (VB get) (NP (NP (DT a) (NN feel)) (PP (IN for) (, ,) (INTJ (UH uh)) (, ,) (UCP (SBAR (WHADVP-2 (WRB how)) (S (NP-SBJ (PRP they)) (VP (VBP treat) (NP (DT the) (NNS kids)) (ADVP-MNR (-NONE- *T*-2))))) (CC and) (, ,) (INTJ (UH uh)) (, ,) (INTJ (UH uh)) (, ,) (SBAR (WHNP-3 (WHNP (WDT what) (NN kind)) (PP (IN of) (NP (NN staff) (NNS members)))) (S (NP-SBJ (PRP they)) (VP (VBP have) (NP (-NONE- *T*-3))))) (CC and) (SBAR (WHNP-4 (WHADJP (WRB how) (JJ much)) (NN turnover)) (S (NP-SBJ (PRP they)) (VP (VBP have) (NP (-NONE- *T*-4))))) (CC and) (NP (NP (NNS things)) (PP (IN like) (NP (DT that)))))))))) (SBAR-TMP (IN before) (S (NP-SBJ (PRP you)) (VP (VBP commit) (NP (PRP$ your) (NN child)) (PP (IN to) (NP (PRP them))))))) (. .) (-DFL- E_S)))","monomorphemic"
"29","149383:62","i think 0 a lot of people are panicked *-1, how kids are turning out *t*-4 and how things are going for kids *t*-5 and realizing 0 they've got *-2 to start *-3 doing something.","no","no","yes","embedded","no","","","","","how","panicked","","","are","","realizing","a","a","",NA,"(WRB how)","how things are going for kids *t*-5","(TOP (S (NP-SBJ (PRP I)) (VP (VBP think) (SBAR (-NONE- 0) (S (NP-SBJ-1 (NP (DT a) (NN lot)) (PP (IN of) (NP (NNS people)))) (VP (VBP are) (VP (VP (JJ panicked) (NP (-NONE- *-1)) (, ,) (SBAR (SBAR (WHADVP-4 (WRB how)) (S (NP-SBJ (NNS kids)) (VP (VBP are) (VP (VBG turning) (PRT (RP out)) (ADVP-MNR (-NONE- *T*-4)))))) (CC and) (SBAR (WHADVP-5 (WRB how)) (S (NP-SBJ (NNS things)) (VP (VBP are) (VP (VBG going) (PP (IN for) (NP (NNS kids))) (ADVP-MNR (-NONE- *T*-5)))))))) (CC and) (VP (VBG realizing) (SBAR (-NONE- 0) (S (NP-SBJ-2 (PRP they)) (VP (VBP 've) (VP (VBN got) (S (NP-SBJ-3 (-NONE- *-2)) (VP (TO to) (VP (VB start) (S (NP-SBJ (-NONE- *-3)) (VP (VBG doing) (NP (NN something))))))))))))))))) (. .) (-DFL- E_S)))","monomorphemic"
"30","104508:4","where do you take your cans *t*-1?","no","no","yes","root","no","yes","","","","","","","","","","","","","",NA,"(WRB Where)","where do you take your cans *t*-1?","(TOP (SBARQ (WHADVP-1 (WRB Where)) (SQ (VBP do) (NP-SBJ (PRP you)) (VP (VB take) (NP (PRP$ your) (NNS cans)) (ADVP-DIR (-NONE- *T*-1)))) (. ?) (-DFL- E_S)))","monomorphemic"
"31","114684:16","w-, where do you work *t*-1?","no","no","yes","root","no","yes","","","","where","","","","","","","","","",NA,"(WRB where)","w-, where do you work *t*-1?","(TOP (SBARQ (EDITED (RM (-DFL- \[)) (WHADVP-UNF (WRB W-)) (, ,) (IP (-DFL- \+))) (WHADVP-1 (WRB where)) (RS (-DFL- \])) (SQ (VBP do) (NP-SBJ (PRP you)) (VP (VB work) (ADVP-LOC (-NONE- *T*-1)))) (. ?) (-DFL- E_S)))","monomorphemic"
"32","89799:36","and oh i, i do not know what the answer is *t*-1,","no","no","yes","embedded","no","","","","","what","know","","","do","know","","the","the","",NA,"(WP what)","what the answer is *t*-1","(TOP (S (CC And) (INTJ (UH oh)) (EDITED (RM (-DFL- \[)) (NP-SBJ (PRP I)) (, ,) (IP (-DFL- \+))) (NP-SBJ (PRP I)) (RS (-DFL- \])) (VP (VBP do) (RB not) (VP (VB know) (SBAR (WHNP-1 (WP what)) (S (NP-SBJ (DT the) (NN answer)) (VP (VBZ is) (NP-PRD (-NONE- *T*-1))))))) (, ,) (-DFL- E_S)))","monomorphemic"
"33","158817:9","um, what's our topic *t*-1?","no","no","yes","exclamation","no","yes","","","","what","","","","","","","","","",NA,"(WP what)","um, what's our topic *t*-1?","(TOP (SBARQ (INTJ (UH Um)) (, ,) (WHNP-1 (WP what)) (SQ (BES 's) (NP-SBJ (PRP$ our) (NN topic)) (NP-PRD (-NONE- *T*-1))) (. ?) (-DFL- E_S)))","monomorphemic"
"34","77769:68","so, we can always run upstairs and, you know, ca-, get a quickie update on what *t*-1's going on, if we really want *-2 to *?*.","no","no","yes","relative","no","","","","","what","","","","run","","run","","a","",NA,"(WP what)","what *t*-1's going on","(TOP (S (RB So) (, ,) (NP-SBJ (PRP we)) (VP (MD can) (ADVP-TMP (RB always)) (VP (VP (VB run) (ADVP-DIR (RB upstairs))) (CC and) (PRN (, ,) (S (NP-SBJ (PRP you)) (VP (VBP know))) (, ,)) (EDITED (RM (-DFL- \[)) (VP-UNF (MD ca-)) (, ,) (IP (-DFL- \+))) (VP (VB get) (RS (-DFL- \])) (NP (NP (DT a) (JJ quickie) (NN update)) (PP (IN on) (SBAR-NOM (WHNP-1 (WP what)) (S (NP-SBJ (-NONE- *T*-1)) (VP (BES 's) (VP (VBG going) (PRT (RP on))))))))) (, ,) (SBAR-ADV (IN if) (S (NP-SBJ-2 (PRP we)) (ADVP (RB really)) (VP (VB want) (S (NP-SBJ (-NONE- *-2)) (VP (TO to) (VP (-NONE- *?*))))))))) (. .) (-DFL- E_S)))","monomorphemic"
"35","176017:4","which *t*-1 could be another mumblex of monty python.","yes","no","yes","subject","no","","","","","","","","could","","","","","another","",NA,"(WDT Which)","which *t*-1 could be another mumblex of monty python.","(TOP (SBAR (WHNP-1 (WDT Which)) (S (NP-SBJ (-NONE- *T*-1)) (VP (MD could) (VP (VB be) (NP-PRD (NP (DT another) (X (XX MUMBLEx))) (PP (IN of) (NP (NNP Monty) (NNP Python))))))) (. .) (-DFL- E_S)))","monomorphemic"
"36","10880:47","uh, oh, that was, that was, uh, what the, much of the hype was *t*-1 that tom cruise learned so much from dustin hoffman.","no","no","yes","nominalized","no","","","much","","what","was","","","was","","","the","the","",NA,"(WP what)","what the, much of the hype was *t*-1","(TOP (S (INTJ (UH uh)) (, ,) (INTJ (UH oh)) (, ,) (EDITED (RM (-DFL- \[)) (S (NP-SBJ (DT that)) (VP-UNF (VBD was))) (, ,) (IP (-DFL- \+))) (NP-SBJ (DT that)) (VP (VBD was) (, ,) (RS (-DFL- \])) (INTJ (UH uh)) (, ,) (SBAR-NOM-PRD (WHNP-1 (WP what)) (S (EDITED (RM (-DFL- \[)) (NP-SBJ-UNF (DT the)) (, ,) (IP (-DFL- \+))) (NP-SBJ (NP (RB much)) (PP (IN of) (NP (DT the) (RS (-DFL- \])) (NN hype)))) (VP (VBD was) (NP-PRD (-NONE- *T*-1))))) (SBAR-TPC (IN that) (S (NP-SBJ (NNP Tom) (NNP Cruise)) (VP (VBD learned) (NP (RB so) (RB much)) (PP (IN from) (NP (NNP Dustin) (NNP Hoffman))))))) (. .) (-DFL- E_S)))","monomorphemic"
"37","53534:25","and, uh, i don't know what i've would have done *t*-1 in the situation.","yes","no","yes","embedded","no","","","","done","what","know","","would","do","know","","","the","",NA,"(WP what)","what i've would have done *t*-1 in the situation","(TOP (S (CC and) (, ,) (INTJ (UH uh)) (, ,) (NP-SBJ (PRP I)) (VP (VBP do) (RB n't) (VP (VB know) (SBAR (WHNP-1 (WP what)) (S (NP-SBJ (PRP I)) (EDITED (VP-UNF (VBP 've))) (VP (MD would) (VP (VB have) (VP (VBN done) (NP (-NONE- *T*-1)) (PP (IN in) (NP (DT the) (NN situation)))))))))) (. .) (-DFL- E_S)))","monomorphemic"
