"","Item_ID","Sentence","ModalPresent","Finite","QuestionType","DegreeQ","SubjectAuxInv","WhAll","QuantifiedSubject","QuantifiedPredicate","MatVerb","Wh","Modal","Verb1","Verb2","DeterminerSubject","DeterminerNonSubject","FullWhPhrase","WhNode","WhParse","Question","SentenceParse","WhPhaseType"
"145","153872:4","what do you do *t*-1?","no","yes","root","no","yes","","","","","","","do","","","","",NA,"(WP What)","what do you do *t*-1?","(TOP (SBARQ (WHNP-1 (WP What)) (SQ (VBP do) (NP-SBJ (PRP you)) (VP (VB do) (NP (-NONE- *T*-1)))) (. ?) (-DFL- E_S)))","monomorphemic"
"146","4449:19","but, the remarkable thing is how well the fads catch on elsewhere *t*-1.","no","yes","embedded","yes","","","","","is","how","","catch","","the","the","how well",NA,"(WRB how)","how well the fads catch on elsewhere *t*-1","(TOP (S (CC but) (, ,) (NP-SBJ (DT the) (JJ remarkable) (NN thing)) (VP (VBZ is) (SBAR-MNR-PRD (WHADVP-1 (WRB how) (RB well)) (S (NP-SBJ (DT the) (NNS fads)) (VP (VBP catch) (PRT (RP on)) (ADVP-LOC (RB elsewhere)) (ADVP (-NONE- *T*-1)))))) (. .) (-DFL- E_S)))","complex"
"147","93723:19","that'll come some day when i,","no","yes","exclamation","no","","","","","come","when","","come","","that","some","",NA,"(WRB when)","when i","(TOP (S (NP-SBJ (DT That)) (VP (MD 'll) (VP (VB come) (NP-TMP (DT some) (NN day)) (SBAR-TMP (WHADVP (WRB when)) (S-UNF (NP-SBJ (PRP I)))))) (, ,) (-DFL- N_S)))","monomorphemic"
"148","5095:10","and then when i start a new project *t*-1, i go through and see if i, if i, you know,","no","yes","embadjunct","no","","","","","","when","","start","","","a","",NA,"(WRB when)","when i start a new project *t*-1","(TOP (S (CONJP (CC and) (RB then)) (SBAR-TMP (WHADVP-1 (WRB when)) (S (NP-SBJ (PRP I)) (VP (VBP start) (NP (DT a) (JJ new) (NN project)) (ADVP-TMP (-NONE- *T*-1))))) (, ,) (NP-SBJ (PRP I)) (VP (VP (VBP go) (PRT (IN through))) (CC and) (VP (VBP see) (SBAR (EDITED (RM (-DFL- \[)) (SBAR (IN if) (S-UNF (NP-SBJ (PRP I)))) (, ,) (IP (-DFL- \+))) (IN if) (S-UNF (NP-SBJ (PRP I)) (, ,) (RS (-DFL- \])) (PRN (S (NP-SBJ (PRP you)) (VP (VBP know)))))))) (, ,) (-DFL- N_S)))","monomorphemic"
"149","176553:10","and then what *t*-1 happened was, is, you know, 0 they gave her a call because they knew that she was my baby-sitter.","no","yes","embadjunct","no","","","","","","what","","happened","","","a","",NA,"(WP what)","what *t*-1 happened","(TOP (S (CONJP (CC And) (RB then)) (SBAR-SBJ (WHNP-1 (WP what)) (S (NP-SBJ (-NONE- *T*-1)) (VP (VBD happened)))) (EDITED (RM (-DFL- \[)) (VP-UNF (VBD was)) (, ,) (IP (-DFL- \+))) (VP (VBZ is) (, ,) (RS (-DFL- \])) (PRN (S (NP-SBJ (PRP you)) (VP (VBP know))) (, ,)) (SBAR (-NONE- 0) (S (NP-SBJ (PRP they)) (VP (VBD gave) (NP (PRP her)) (NP (DT a) (NN call)) (SBAR-PRP (IN because) (S (NP-SBJ (PRP they)) (VP (VBD knew) (SBAR (IN that) (S (NP-SBJ (PRP she)) (VP (VBD was) (NP-PRD (PRP$ my) (NN baby-sitter)))))))))))) (. .) (-DFL- E_S)))","monomorphemic"
"150","8504:129","but the thing is, is that, um, i have *-1 to keep it under control because, for example, you know, it's like the, the beginning of the semester when you go *-2 to pay for everything *t*-3, everything is pretty rough,","no","yes","embedded","no","","","","everything","keep","when","","go","","the","the","",NA,"(WRB when)","when you go *-2 to pay for everything *t*-3,","(TOP (S (CC but) (NP-SBJ (DT the) (NN thing)) (EDITED (RM (-DFL- \[)) (VP-UNF (VBZ is)) (, ,) (IP (-DFL- \+))) (VP (VBZ is) (RS (-DFL- \])) (SBAR-PRD (IN that) (, ,) (INTJ (UH um)) (, ,) (S (NP-SBJ-1 (PRP I)) (VP (VBP have) (S (NP-SBJ (-NONE- *-1)) (VP (TO to) (VP (VB keep) (NP (PRP it)) (PP (IN under) (NP (NN control))) (SBAR-PRP (IN because) (, ,) (S (PP (IN for) (NP (NN example))) (PRN (, ,) (S (NP-SBJ (PRP you)) (VP (VBP know))) (, ,)) (NP-SBJ (PRP it)) (VP (BES 's) (SBAR-PRD (IN like) (S (EDITED (RM (-DFL- \[)) (NP-TMP-UNF (DT the)) (, ,) (IP (-DFL- \+))) (NP-TMP (NP (DT the) (RS (-DFL- \])) (NN beginning)) (PP (IN of) (NP (DT the) (NN semester)))) (SBAR-TMP (WHADVP-3 (WRB when)) (S (NP-SBJ-2 (PRP you)) (VP (VBP go) (S (NP-SBJ (-NONE- *-2)) (VP (TO to) (VP (VB pay) (PP (IN for) (NP (NN everything))) (ADVP-TMP (-NONE- *T*-3))))))) (, ,)) (NP-SBJ (NN everything)) (VP (VBZ is) (ADJP-PRD (RB pretty) (JJ rough))))))))))))))) (, ,) (-DFL- E_S)))","monomorphemic"
"151","41175:17","they have these places where you can rent them *t*-1","no","yes","relative","no","","","","","","where","","rent","","","these","",NA,"(WRB where)","where you can rent them *t*-1","(TOP (S (NP-SBJ (PRP They)) (VP (VBP have) (NP (NP (DT these) (NNS places)) (SBAR (WHADVP-1 (WRB where)) (S (NP-SBJ (PRP you)) (VP (MD can) (VP (VB rent) (NP (PRP them)) (ADVP-LOC (-NONE- *T*-1)))))))) (-DFL- E_S)))","monomorphemic"
"152","110331:54","well, but why, if you're going *-1 to do teachers or professionals, why not * do the kids, when we see them *t*-2 and they're, you know, under the influence *t*-2.","no","yes","subject","yes","","","","","","why","","'re","","","the","",NA,"(WRB why)","well, but why, if you're going *-1 to do teachers or professionals, why not * do the kids, when we see them *t*-2 and they're, you know, under the influence *t*-2.","(TOP (SBAR (INTJ (UH well)) (, ,) (CC but) (EDITED (RM (-DFL- \[)) (SBAR-UNF (WRB why)) (, ,) (IP (-DFL- \+))) (SBAR-ADV (IN if) (S (NP-SBJ-1 (PRP you)) (VP (VBP 're) (VP (VBG going) (S (NP-SBJ (-NONE- *-1)) (VP (TO to) (VP (VB do) (NP (NNS teachers) (CC or) (NNS professionals))))))))) (, ,) (WRB why) (RS (-DFL- \])) (RB not) (S (NP-SBJ (-NONE- *)) (VP (VB do) (NP (DT the) (NNS kids)) (, ,) (SBAR-TMP (WHADVP-2 (WRB when)) (S (S (NP-SBJ (PRP we)) (VP (VBP see) (NP (PRP them)) (ADVP-TMP (-NONE- *T*-2)))) (CC and) (S (NP-SBJ (PRP they)) (VP (VBP 're) (PRN (, ,) (S (NP-SBJ (PRP you)) (VP (VBP know))) (, ,)) (PP-PRD (IN under) (NP (DT the) (NN influence))) (ADVP-TMP (-NONE- *T*-2)))))))) (. .) (-DFL- E_S)))","complex"
"153","103283:70","but, you know when i hear about things like, you know, what they've, what they've been reporting about *t*-1 in milwaukee, you know *t*-2 i, i, to me i don't see any way of * rehabilitating the guy.","no","yes","relative","no","","","","","","what","","'ve","","","any","",NA,"(WP what)","what they've been reporting about *t*-1 in milwaukee, you know","(TOP (S (CC but) (PRN (, ,) (S (NP-SBJ (PRP you)) (VP (VBP know)))) (SBAR-TMP (WHADVP-2 (WRB when)) (S (NP-SBJ (PRP I)) (VP (VBP hear) (PP (IN about) (NP (NP (NNS things)) (PP (IN like) (PRN (, ,) (S (NP-SBJ (PRP you)) (VP (VBP know))) (, ,)) (EDITED (RM (-DFL- \[)) (SBAR-NOM (WHNP (WP what)) (S (NP-SBJ (PRP they)) (VP-UNF (VBP 've)))) (, ,) (IP (-DFL- \+))) (SBAR-NOM (WHNP-1 (WP what)) (S (NP-SBJ (PRP they)) (VP (VBP 've) (RS (-DFL- \])) (VP (VBN been) (VP (VBG reporting) (PP (IN about) (NP (-NONE- *T*-1))) (PP-LOC (IN in) (NP (NNP Milwaukee))) (PRN (, ,) (S (NP-SBJ (PRP you)) (VP (VBP know)))))))))))) (ADVP-TMP (-NONE- *T*-2))))) (EDITED (RM (-DFL- \[)) (EDITED (RM (-DFL- \[)) (NP-SBJ (PRP I)) (, ,) (IP (-DFL- \+))) (NP-SBJ (PRP I)) (, ,) (RS (-DFL- \])) (IP (-DFL- \+))) (PP (IN to) (NP (PRP me))) (NP-SBJ (PRP I)) (RS (-DFL- \])) (VP (VBP do) (RB n't) (VP (VB see) (NP (NP (DT any) (NN way)) (PP (IN of) (S-NOM (NP-SBJ (-NONE- *)) (VP (VBG rehabilitating) (NP (DT the) (NN guy)))))))) (. .) (-DFL- E_S)))","monomorphemic"
"154","42729:114","i think 0 that's a lot of it too, is that people need *-1 to teach their kids, what * not to, what * to do *t*-2 and what * not to do *t*-3.","no","yes","nominalized","no","","","","","teach","what","","do","","that","that","",NA,"(WP what)","what * not to do *t*-3","(TOP (S (NP-SBJ (PRP I)) (VP (VBP think) (SBAR (-NONE- 0) (S (S-SBJ (NP-SBJ (DT that)) (VP (BES 's) (NP-PRD (NP (DT a) (NN lot)) (PP (IN of) (NP (PRP it)))) (ADVP (RB too)))) (, ,) (VP (VBZ is) (SBAR-PRD (IN that) (S (NP-SBJ-1 (NNS people)) (VP (VBP need) (S (NP-SBJ (-NONE- *-1)) (VP (TO to) (VP (VB teach) (NP (PRP$ their) (NNS kids)) (, ,) (EDITED (RM (-DFL- \[)) (SBAR (WHNP (WP what)) (S (NP-SBJ (-NONE- *)) (RB not) (VP-UNF (TO to)))) (, ,) (IP (-DFL- \+))) (SBAR-NOM (SBAR (WHNP-2 (WP what)) (S (NP-SBJ (-NONE- *)) (VP (TO to) (VP (VB do) (NP (-NONE- *T*-2)))))) (RS (-DFL- \])) (CC and) (SBAR (WHNP-3 (WP what)) (S (NP-SBJ (-NONE- *)) (RB not) (VP (TO to) (VP (VB do) (NP (-NONE- *T*-3))))))))))))))))) (. .) (-DFL- E_S)))","monomorphemic"
"155","3066:21","i know 0 that's what we're supposed *-1 to do *t*-2.","no","yes","embedded","no","","","","","know","what","","'re","","that","that","",NA,"(WP what)","what we're supposed *-1 to do *t*-2","(TOP (S (NP-SBJ (PRP I)) (VP (VBP know) (SBAR (-NONE- 0) (S (NP-SBJ (DT that)) (VP (BES 's) (SBAR-NOM-PRD (WHNP-2 (WP what)) (S (NP-SBJ-1 (PRP we)) (VP (VBP 're) (VP (VBN supposed) (S (NP-SBJ (-NONE- *-1)) (VP (TO to) (VP (VB do) (NP (-NONE- *T*-2))))))))))))) (. .) (-DFL- E_S)))","monomorphemic"
"156","13803:41","i just know, i know several single mothers who *t*-1 absolutely can't afford it.","no","yes","relative","no","","","","","","who","","afford","","","","",NA,"(WP who)","who *t*-1 absolutely can't afford it","(TOP (S (EDITED (RM (-DFL- \[)) (S (NP-SBJ (PRP I)) (ADVP (RB just)) (VP-UNF (VBP know))) (, ,) (IP (-DFL- \+))) (NP-SBJ (PRP I)) (VP (VBP know) (RS (-DFL- \])) (NP (NP (JJ several) (JJ single) (NNS mothers)) (SBAR (WHNP-1 (WP who)) (S (NP-SBJ (-NONE- *T*-1)) (ADVP (RB absolutely)) (VP (MD ca) (RB n't) (VP (VB afford) (NP (PRP it)))))))) (. .) (-DFL- E_S)))","monomorphemic"
"157","6220:111","now that i'm a hundred percent vested *-1, you know, you kind of look through the book and see well, what exactly, what does that mean *t*-2 and what is the pension all about *t*-3","no","yes","embedded","no","yes","","","","see","what","","does","","the","the","",NA,"(WP what)","what is the pension all about *t*-3","(TOP (S (ADVP-TMP (RB now) (SBAR (IN that) (S (NP-SBJ-1 (PRP I)) (VP (VBP 'm) (NP-EXT (DT a) (CD hundred) (NN percent)) (VP (JJ vested) (NP (-NONE- *-1))))))) (PRN (, ,) (S (NP-SBJ (PRP you)) (VP (VBP know))) (, ,)) (NP-SBJ (PRP you)) (ADVP (RB kind) (RB of)) (VP (VP (VBP look) (PP (IN through) (NP (DT the) (NN book)))) (CC and) (VP (VBP see) (SBARQ (INTJ (UH well)) (, ,) (SBARQ (EDITED (RM (-DFL- \[)) (SBARQ-UNF (WHNP (WP what) (ADVP (RB exactly)))) (, ,) (IP (-DFL- \+))) (WHNP-2 (WP what)) (RS (-DFL- \])) (SQ (VBZ does) (NP-SBJ (DT that)) (VP (VBP mean) (NP (-NONE- *T*-2))))) (CC and) (SBARQ (WHNP-3 (WP what)) (SQ (VBZ is) (NP-SBJ (DT the) (NN pension)) (PP-PRD (ADVP (DT all)) (IN about) (NP (-NONE- *T*-3)))))))) (-DFL- E_S)))","monomorphemic"
"158","53568:47","were, were they in any of the areas where they, some of the scuds?","no","yes","exclamation","no","","","some","","","where","","","","some","","",NA,"(WRB where)","where they, some of the scuds","(TOP (SQ (RM (-DFL- \[)) (EDITED (RM (-DFL- \[)) (SQ-UNF (VBD Were)) (, ,) (IP (-DFL- \+))) (VBD were) (RS (-DFL- \])) (NP-SBJ (PRP they)) (IP (-DFL- \+)) (PP-LOC-PRD (IN in) (NP (NP (DT any)) (PP (IN of) (NP (NP (DT the) (NNS areas)) (SBAR (WHADVP (WRB where)) (S-UNF (EDITED (NP-SBJ (PRP they))) (, ,) (RS (-DFL- \])) (NP-SBJ (NP (DT some)) (PP (IN of) (NP (DT the) (NNS Scuds)))))))))) (. ?) (-DFL- E_S)))","monomorphemic"
"159","102358:7","and when i go *t*-1, i go *-2 see two at a time.","no","yes","embadjunct","no","","","","","","when","","go","","","a","",NA,"(WRB when)","when i go *t*-1","(TOP (S (CC And) (SBAR-TMP (WHADVP-1 (WRB when)) (S (NP-SBJ (PRP I)) (VP (VBP go) (ADVP-TMP (-NONE- *T*-1))))) (, ,) (NP-SBJ-2 (PRP I)) (VP (VBP go) (S (NP-SBJ (-NONE- *-2)) (VP (VB see) (NP (CD two)) (PP-TMP (IN at) (NP (DT a) (NN time)))))) (. .) (-DFL- E_S)))","monomorphemic"
"160","116745:8","so what *ich*-2 have you seen *t*-1 interesting on oprah winfrey lately?","no","yes","root","no","yes","","","","","what","","have","","","","",NA,"(WP what)","so what *ich*-2 have you seen *t*-1 interesting on oprah winfrey lately?","(TOP (SBARQ (INTJ (UH So)) (WHNP-1 (WHNP (WP what)) (ADJP (-NONE- *ICH*-2))) (SQ (VBP have) (NP-SBJ (PRP you)) (VP (VBN seen) (NP (-NONE- *T*-1)) (ADJP-2 (JJ interesting)) (PP (IN on) (NP-TTL (NNP OPRAH) (NNP WINFREY))) (ADVP-TMP (RB lately)))) (. ?) (-DFL- E_S)))","monomorphemic"
"161","174705:77","i wish 0 if they were going *-1 to do it, they would be a little more consistent in *-3 dealing with who *t*-2 gets lethal injection and who *t*-4 doesn't.","no","yes","relative","no","","","","","wish","who","","gets","","","a","",NA,"(WP who)","who *t*-2 gets lethal injection","(TOP (S (NP-SBJ (PRP I)) (VP (VBP wish) (SBAR (-NONE- 0) (S (SBAR-ADV (IN if) (S (NP-SBJ-1 (PRP they)) (VP (VBD were) (VP (VBG going) (S (NP-SBJ (-NONE- *-1)) (VP (TO to) (VP (VB do) (NP (PRP it))))))))) (, ,) (NP-SBJ-3 (PRP they)) (VP (MD would) (VP (VB be) (ADJP-PRD (ADJP (NP-ADV (DT a) (RB little)) (RBR more)) (JJ consistent) (PP (IN in) (S-NOM (NP-SBJ (-NONE- *-3)) (VP (VBG dealing) (PP (IN with) (NP (SBAR-NOM (WHNP-2 (WP who)) (S (NP-SBJ (-NONE- *T*-2)) (VP (VBZ gets) (NP (JJ lethal) (NN injection))))) (CC and) (SBAR-NOM (WHNP-4 (WP who)) (S (NP-SBJ (-NONE- *T*-4)) (VP (VBZ does) (RB n't))))))))))))))) (. .) (-DFL- E_S)))","monomorphemic"
"162","129702:16","what, what do you do *t*-1, now?","no","yes","root","no","yes","","","","","what","","do","","","","",NA,"(WP what)","what, what do you do *t*-1, now?","(TOP (SBARQ (EDITED (RM (-DFL- \[)) (WHNP (WP what)) (, ,) (IP (-DFL- \+))) (WHNP-1 (WP what)) (RS (-DFL- \])) (SQ (VBP do) (NP-SBJ (PRP you)) (VP (VB do) (NP (-NONE- *T*-1)) (, ,) (ADVP-TMP (RB now)))) (. ?) (-DFL- E_S)))","monomorphemic"
"163","176634:30","it, to me, no matter how much the, th-, our company claims 0 it's not a constitutional issue. that, because this is, uh, between a company and an employee it is not, it is not a government *t*-1,","no","yes","subject","yes","","","company","company","","how","","claims","","the","a","how much",NA,"(WRB how)","how much the, th-, our company claims 0 it's not a constitutional issue. that, because this is, uh, between a company and an employee it is not, it is not a government *t*-1","(TOP (FRAG (EDITED (RM (-DFL- \[)) (NP-SBJ (PRP it)) (, ,) (IP (-DFL- \+))) (PP (IN to) (NP (PRP me))) (, ,) (ADVP (DT no) (NN matter) (SBAR (WHADVP-1 (WRB how) (JJ much)) (S (EDITED (RM (-DFL- \[)) (EDITED (RM (-DFL- \[)) (NP-SBJ-UNF (DT the)) (, ,) (IP (-DFL- \+))) (NP-SBJ-UNF (DT th-)) (, ,) (RS (-DFL- \])) (IP (-DFL- \+))) (NP-SBJ (PRP$ our) (RS (-DFL- \])) (NN company)) (VP (VBZ claims) (SBAR (SBAR (-NONE- 0) (S (NP-SBJ (PRP it)) (VP (BES 's) (RS (-DFL- \])) (RB not) (NP-PRD (DT a) (JJ constitutional) (NN issue))))) (. .) (SBAR (DT That) (, ,) (S (SBAR-PRP (IN because) (S (NP-SBJ (DT this)) (VP (VBZ is) (, ,) (INTJ (UH uh)) (, ,) (PP-PRD (IN between) (NP (NP (DT a) (NN company)) (CC and) (NP (DT an) (NN employee))))))) (EDITED (RM (-DFL- \[)) (S (NP-SBJ (PRP it)) (VP-UNF (VBZ is) (RB not))) (, ,) (IP (-DFL- \+))) (NP-SBJ (PRP it)) (VP (VBZ is) (RB not) (RS (-DFL- \])) (NP-PRD-UNF (DT a) (NN government)))))) (ADVP (-NONE- *T*-1)))))) (, ,) (-DFL- E_S)))","complex"
"164","83488:4","how did you put that many miles on it, in, four or five years *t*-1?","no","yes","root","no","yes","","","many","","","","did","","","","",NA,"(WRB How)","how did you put that many miles on it, in, four or five years *t*-1?","(TOP (SBARQ (WHADVP-1 (WRB How)) (SQ (VBD did) (NP-SBJ (PRP you)) (VP (VBN put) (NP (ADJP (RB that) (JJ many)) (NNS miles)) (PP-PUT (IN on) (NP (PRP it))) (, ,) (PP-TMP (IN in) (, ,) (NP (QP (CD four) (CC or) (CD five)) (NNS years))) (ADVP-MNR (-NONE- *T*-1)))) (. ?) (-DFL- E_S)))","monomorphemic"
"165","146913:65","well, um, i'm going *-1 to talk about when i was working as a teacher *t*-2 and when i was working at now *t*-3.","no","yes","subject","no","","","","","going","when","","was","","","a","",NA,"(WRB when)","when i was working at now *t*-3","(TOP (S (INTJ (UH Well)) (, ,) (INTJ (UH um)) (, ,) (NP-SBJ-1 (PRP I)) (VP (VBP 'm) (VP (VBG going) (S (NP-SBJ (-NONE- *-1)) (VP (TO to) (VP (VB talk) (PP (IN about) (SBAR (SBAR (WHADVP-2 (WRB when)) (S (NP-SBJ (PRP I)) (VP (VBD was) (VP (VBG working) (PP (IN as) (NP (DT a) (NN teacher))) (ADVP-TMP (-NONE- *T*-2)))))) (CC and) (SBAR (WHADVP-3 (WRB when)) (S (NP-SBJ (PRP I)) (VP (VBD was) (VP (VBG working) (X (PP-UNF (IN at)) (ADVP-TMP (RB now))) (ADVP-TMP (-NONE- *T*-3))))))))))))) (. .) (-DFL- E_S)))","monomorphemic"
"166","124643:97","so, but i, i's, i, i put that against, uh, my high school where we had, uh, a biology class of three hundred and fifty students *t*-1","no","yes","relative","no","","","","","","where","","had","","","a","",NA,"(WRB where)","where we had, uh, a biology class of three hundred and fifty students *t*-1","(TOP (S (EDITED (RM (-DFL- \[)) (RB So) (, ,) (IP (-DFL- \+))) (CC but) (RS (-DFL- \])) (EDITED (RM (-DFL- \[)) (EDITED (RM (-DFL- \[)) (EDITED (RM (-DFL- \[)) (NP-SBJ (PRP I)) (, ,) (IP (-DFL- \+))) (S (NP-SBJ (PRP I)) (VP-UNF (BES 's))) (, ,) (RS (-DFL- \])) (IP (-DFL- \+))) (NP-SBJ (PRP I)) (, ,) (RS (-DFL- \])) (IP (-DFL- \+))) (NP-SBJ (PRP I)) (RS (-DFL- \])) (VP (VBP put) (NP (DT that)) (PP-PUT (IN against) (, ,) (INTJ (UH uh)) (, ,) (NP (NP (PRP$ my) (JJ high) (NN school)) (SBAR (WHADVP-1 (WRB where)) (S (NP-SBJ (PRP we)) (VP (VBD had) (, ,) (INTJ (UH uh)) (, ,) (NP (NP (DT a) (NN biology) (NN class)) (PP (IN of) (NP (QP (CD three) (CD hundred) (CC and) (CD fifty)) (NNS students)))) (ADVP-LOC (-NONE- *T*-1)))))))) (-DFL- E_S)))","monomorphemic"
"167","80307:5","what kind of painting are you planning *-2 to do *t*-1?","no","yes","root","no","yes","","","","","","","are","","","","what kind",NA,"(WDT What)","what kind of painting are you planning *-2 to do *t*-1?","(TOP (SBARQ (WHNP-1 (WHNP (WDT What) (NN kind)) (PP (IN of) (NP (NN painting)))) (SQ (VBP are) (NP-SBJ-2 (PRP you)) (VP (VBG planning) (S (NP-SBJ (-NONE- *-2)) (VP (TO to) (VP (VB do) (NP (-NONE- *T*-1))))))) (. ?) (-DFL- E_S)))","complex"
"168","44060:7","so what *t*-1 had happened is that professional painters had not prepared the surface properly.","no","yes","embadjunct","no","","","","","","what","","had","","","the","",NA,"(WP what)","what *t*-1 had happened","(TOP (S (RB So) (SBAR-NOM-SBJ (WHNP-1 (WP what)) (S (NP-SBJ (-NONE- *T*-1)) (VP (VBD had) (VP (VBN happened))))) (VP (VBZ is) (SBAR-PRD (IN that) (S (NP-SBJ (JJ professional) (NNS painters)) (VP (VBD had) (RB not) (VP (VBN prepared) (NP (DT the) (NN surface)) (ADVP-MNR (RB properly))))))) (. .) (-DFL- E_S)))","monomorphemic"
"169","40493:157","and, uh, when school lets out *t*-1, i just don't, i haven't, i have no idea what i'm going *-2 to do *t*-3, because i certainly can't afford what we did *t*-4 last year which *t*-5 was,","no","yes","nominalized","no","","","","","afford","which","","was","","","which","",NA,"(WDT which)","which *t*-5 was","(TOP (S (CC and) (, ,) (INTJ (UH uh)) (, ,) (SBAR-TMP (WHADVP-1 (WRB when)) (S (NP-SBJ (NN school)) (VP (VBZ lets) (PRT (RP out)) (ADVP-TMP (-NONE- *T*-1))))) (, ,) (EDITED (RM (-DFL- \[)) (EDITED (RM (-DFL- \[)) (S (NP-SBJ (PRP I)) (ADVP (RB just)) (VP-UNF (VBP do) (RB n't))) (, ,) (IP (-DFL- \+))) (S (NP-SBJ (PRP I)) (VP-UNF (VBP have) (RB n't))) (, ,) (RS (-DFL- \])) (IP (-DFL- \+))) (NP-SBJ (PRP I)) (VP (VBP have) (RS (-DFL- \])) (NP (NP (DT no) (NN idea)) (SBAR (WHNP-3 (WP what)) (S (NP-SBJ-2 (PRP I)) (VP (VBP 'm) (VP (VBG going) (S (NP-SBJ (-NONE- *-2)) (VP (TO to) (VP (VB do) (NP (-NONE- *T*-3)))))))))) (, ,) (SBAR-PRP (IN because) (S (NP-SBJ (PRP I)) (ADVP (RB certainly)) (VP (MD ca) (RB n't) (VP (VB afford) (SBAR-NOM (WHNP-4 (WP what)) (S (NP-SBJ (PRP we)) (VP (VP (VBD did) (NP (-NONE- *T*-4)) (NP-TMP (JJ last) (NN year))) (SBAR (WHNP-5 (WDT which)) (S (NP-SBJ (-NONE- *T*-5)) (VP-UNF (VBD was)))))))))))) (, ,) (-DFL- N_S)))","monomorphemic"
"170","80520:91","and then if that, if you discover the little tricks and tips about, you know, how you get through corners *t*-1 and how you do trim *t*-2 and, uh, how long * to leave the masking tape down *t*-3, because if you leave it too long and it dries it can flake when it, when you pull it up *t*-4.","no","yes","relative","no","","","","","","how","","do","","","the","",NA,"(WRB how)","how you do trim *t*-2","(TOP (FRAG (CONJP (CC And) (RB then)) (SBAR-ADV (EDITED (RM (-DFL- \[)) (SBAR-ADV (IN if) (S-UNF (NP-SBJ (IN that)))) (, ,) (IP (-DFL- \+))) (IN if) (S (NP-SBJ (PRP you)) (RS (-DFL- \])) (VP (VBP discover) (NP (NP (DT the) (JJ little) (NNS tricks)) (CC and) (NP (NP (NNS tips)) (PP (IN about) (PRN (, ,) (S (NP-SBJ (PRP you)) (VP (VBP know))) (, ,)) (SBAR (SBAR (WHADVP-1 (WRB how)) (S (NP-SBJ (PRP you)) (VP (VBP get) (PP (IN through) (NP (NNS corners))) (ADVP-MNR (-NONE- *T*-1))))) (CC and) (SBAR (WHADVP-2 (WRB how)) (S (NP-SBJ (PRP you)) (VP (VBP do) (NP (NN trim)) (ADVP-MNR (-NONE- *T*-2))))) (CC and) (, ,) (INTJ (UH uh)) (, ,) (SBAR (WHADVP-3 (WRB how) (RB long)) (S (NP-SBJ (-NONE- *)) (VP (TO to) (VP (VB leave) (NP (DT the) (NN masking) (NN tape)) (PRT (RB down)) (ADVP (-NONE- *T*-3)) (, ,) (SBAR-PRP (IN because) (S (SBAR-ADV (IN if) (S (S (NP-SBJ (PRP you)) (VP (VBP leave) (NP (PRP it)) (ADVP (RB too) (RB long)))) (CC and) (S (NP-SBJ (PRP it)) (VP (VBZ dries))))) (NP-SBJ (PRP it)) (VP (MD can) (VP (VB flake) (SBAR-TMP (EDITED (RM (-DFL- \[)) (SBAR (WHADVP (WRB when)) (S-UNF (NP-SBJ (PRP it)))) (, ,) (IP (-DFL- \+))) (WHADVP-4 (WRB when)) (S (NP-SBJ (PRP you)) (RS (-DFL- \])) (VP (VBP pull) (NP (PRP it)) (PRT (RB up)) (ADVP-TMP (-NONE- *T*-4)))))))))))))))))))) (. .) (-DFL- E_S)))","monomorphemic"
"171","114971:5","what kind of books do you like *-2 to read *t*-1?","no","yes","root","no","yes","","","","","","","do","","","","what kind",NA,"(WDT What)","what kind of books do you like *-2 to read *t*-1?","(TOP (SBARQ (WHNP-1 (WHNP (WDT What) (NN kind)) (PP (IN of) (NP (NNS books)))) (SQ (VBP do) (NP-SBJ-2 (PRP you)) (VP (VB like) (S (NP-SBJ (-NONE- *-2)) (VP (TO to) (VP (VB read) (NP (-NONE- *T*-1))))))) (. ?) (-DFL- E_S)))","complex"
"172","169478:13","by the way when you say 0 most people think 0 it is *?* *t*-1, i think 0 it's like ninety-nine point ninety-nine *ich*-2 think 0 it is *?*, percent.","no","yes","embadjunct","no","","","most","most","","when","","say","","","","",NA,"(WRB when)","when you say 0 most people think 0 it is *?* *t*-1","(TOP (S (PP (IN By) (NP (DT the) (NN way))) (SBAR-TMP (WHADVP-1 (WRB when)) (S (NP-SBJ (PRP you)) (VP (VBP say) (SBAR (-NONE- 0) (S (NP-SBJ (JJS most) (NNS people)) (VP (VBP think) (SBAR (-NONE- 0) (S (NP-SBJ (PRP it)) (VP (VBZ is) (ADJP-PRD (-NONE- *?*)))))))) (ADVP-TMP (-NONE- *T*-1))))) (, ,) (-DFL- E_S) (NP-SBJ (PRP I)) (VP (VBP think) (SBAR (-NONE- 0) (S (NP-SBJ (PRP it)) (VP (BES 's) (SBAR-PRD (IN like) (S (NP-SBJ (QP (CD ninety-nine) (NN point) (CD ninety-nine)) (NAC (-NONE- *ICH*-2))) (VP (VBP think) (SBAR (-NONE- 0) (S (NP-SBJ (PRP it)) (VP (VBZ is) (ADJP-PRD (-NONE- *?*))))) (, ,) (NAC-2 (NN percent))))))))) (. .) (-DFL- E_S)))","monomorphemic"
"173","165717:17","so, uh, well how long have you been married *t*-1?","no","yes","root","yes","yes","","","","","how","","have","","","","how long",NA,"(WRB how)","so, uh, well how long have you been married *t*-1?","(TOP (SBARQ (INTJ (UH So)) (, ,) (INTJ (UH uh)) (, ,) (INTJ (UH well)) (WHADVP-1 (WRB how) (RB long)) (SQ (VBP have) (NP-SBJ (PRP you)) (VP (VBN been) (ADJP-PRD (JJ married)) (ADVP-TMP (-NONE- *T*-1)))) (. ?) (-DFL- E_S)))","complex"
"174","62922:16","that makes a difference when you have somebody 0 * to go with *t*-1 and 0 *t*-2 to do the same the same thing *t*-3.","no","yes","embedded","no","","","","somebody","makes","when","","have","","that","the","",NA,"(WRB when)","when you have somebody 0 * to go with *t*-1 and 0 *t*-2 to do the same the same thing *t*-3","(TOP (S (NP-SBJ (DT that)) (VP (VBZ makes) (NP (DT a) (NN difference)) (SBAR-TPC (WHADVP-3 (WRB when)) (S (NP-SBJ (PRP you)) (VP (VBP have) (NP (NP (NN somebody)) (SBAR (SBAR (WHNP-1 (-NONE- 0)) (S (NP-SBJ (-NONE- *)) (VP (TO to) (VP (VB go) (PP (IN with) (NP (-NONE- *T*-1))))))) (CC and) (SBAR (WHNP-2 (-NONE- 0)) (S (NP-SBJ (-NONE- *T*-2)) (VP (TO to) (VP (VB do) (EDITED (NP-UNF (DT the) (JJ same))) (NP (DT the) (JJ same) (NN thing)))))))) (ADVP-TMP (-NONE- *T*-3)))))) (. .) (-DFL- E_S)))","monomorphemic"
"175","93696:121","and what *t*-1's real funny about plans is that there's a struggle between, uh, when you, when you add something to your life *t*-2, when you add a plan to your life *t*-3,","no","yes","nominalized","no","","","","something","is","when","","add","","","a","",NA,"(WRB when)","when you, when you add something to your life *t*-2, when you add a plan to your life *t*-3","(TOP (S (CC and) (SBAR-NOM-SBJ (WHNP-1 (WP what)) (S (NP-SBJ (-NONE- *T*-1)) (VP (BES 's) (ADJP-PRD (RB real) (JJ funny) (PP (IN about) (NP (NNS plans))))))) (VP (VBZ is) (SBAR-NOM-PRD (IN that) (S (NP-SBJ (EX there)) (VP (BES 's) (NP-PRD (DT a) (NN struggle)) (EDITED (RM (-DFL- \[)) (PP-UNF (IN between)) (, ,) (IP (-DFL- \+))) (RS (-DFL- \])) (INTJ (UH uh)) (, ,) (SBAR-TMP (EDITED (RM (-DFL- \[)) (EDITED (RM (-DFL- \[)) (SBAR (WHADVP (WRB when)) (S-UNF (NP-SBJ (PRP you))) (, ,) (IP (-DFL- \+)))) (SBAR-TMP (WHADVP-2 (WRB when)) (S (NP-SBJ (PRP you)) (VP (VBP add) (NP (NN something)) (PP (IN to) (NP (PRP$ your) (NN life))) (ADVP-TMP (-NONE- *T*-2))))) (, ,) (RS (-DFL- \])) (IP (-DFL- \+))) (WHADVP-3 (WRB when)) (S (NP-SBJ (PRP you)) (VP (VBP add) (NP (DT a) (NN plan)) (PP (TO to) (NP (PRP$ your) (NN life))) (ADVP-TMP (-NONE- *T*-3))))))))) (, ,) (RS (-DFL- \])) (-DFL- E_S)))","monomorphemic"
